name,city,area,avgrating,totalratingsstring,cuisines,costfortwostrings,deliverytime,veg,address,diet,price_level,rag_text
Italian hub,Hyderabad,Charminar,--,Too Few Ratings,['European' 'American' 'Chinese'],₹250 FOR TWO,45.0,True,21-7-315 Shakkar Kotha Mitti Ka Sher Char Kaman Ghansi Bazaar Hyderabad Telangana 500002 India,Veg,Low,Restaurant: Italian hub. Area: Charminar. Cuisine: ['European' 'American' 'Chinese']. Budget: Low. Rating: --. Reviews: Too Few Ratings. Diet: Veg. Delivery: 45.0 mins. Address: 21-7-315 Shakkar Kotha Mitti Ka Sher Char Kaman Ghansi Bazaar Hyderabad Telangana 500002 India.
The Sandwich Story,Hyderabad,Banjara Hills,--,Too Few Ratings,['Healthy Food' 'Snacks'],₹200 FOR TWO,72.0,False,H.No.8-2-616/D/1 Road No - 11 Banjara Hills Hyderabad - 500034.,Non-Veg,Low,Restaurant: The Sandwich Story. Area: Banjara Hills. Cuisine: ['Healthy Food' 'Snacks']. Budget: Low. Rating: --. Reviews: Too Few Ratings. Diet: Non-Veg. Delivery: 72.0 mins. Address: H.No.8-2-616/D/1 Road No - 11 Banjara Hills Hyderabad - 500034..
Mendy's Burger,Hyderabad,Banjara Hills,--,Too Few Ratings,['Continental' 'Beverages'],₹500 FOR TWO,68.0,False,H. No.8-2- 372 ROAD NO-5 D K BASTHI BANJARA HILLS Circle No.10 (Old MCH Circle-V) KHAIRATABAD HYDERABAD CENTRAL ZONE TELANGANA 500034,Non-Veg,Medium,Restaurant: Mendy's Burger. Area: Banjara Hills. Cuisine: ['Continental' 'Beverages']. Budget: Medium. Rating: --. Reviews: Too Few Ratings. Diet: Non-Veg. Delivery: 68.0 mins. Address: H. No.8-2- 372 ROAD NO-5 D K BASTHI BANJARA HILLS Circle No.10 (Old MCH Circle-V) KHAIRATABAD HYDERABAD CENTRAL ZONE TELANGANA 500034.
Lazeez Khaana,Hyderabad,Himayath Nagar,--,Too Few Ratings,['Chinese' 'Biryani' 'Mughlai' 'North Indian' 'Haleem'],₹350 FOR TWO,37.0,False,3-6-106/5/2 Queens Court Apartment Opposite Vijaya Diagnostics Centre Himayath Nagar Hyderabad 500029,Non-Veg,Medium,Restaurant: Lazeez Khaana. Area: Himayath Nagar. Cuisine: ['Chinese' 'Biryani' 'Mughlai' 'North Indian' 'Haleem']. Budget: Medium. Rating: --. Reviews: Too Few Ratings. Diet: Non-Veg. Delivery: 37.0 mins. Address: 3-6-106/5/2 Queens Court Apartment Opposite Vijaya Diagnostics Centre Himayath Nagar Hyderabad 500029.
Ofen,Hyderabad,Banjara Hills,4.3,100+ ratings,['European' 'Italian' 'Continental' 'Desserts'],₹300 FOR TWO,59.0,False,49 Ground Floor Road No. 10 Banjara Hills Hyderabad Telangana 500034 India,Non-Veg,Medium,Restaurant: Ofen. Area: Banjara Hills. Cuisine: ['European' 'Italian' 'Continental' 'Desserts']. Budget: Medium. Rating: 4.3. Reviews: 100+ ratings. Diet: Non-Veg. Delivery: 59.0 mins. Address: 49 Ground Floor Road No. 10 Banjara Hills Hyderabad Telangana 500034 India.
Sitara Grand - Nizami Pakwaan,Hyderabad,Banjara Hills,3.6,100+ ratings,['Biryani' 'Chinese' 'South Indian' 'North Indian' 'Tandoor'],₹300 FOR TWO,62.0,False,Hotel Sitara Grand Road Number 12 Banjara Hills Hyderabad,Non-Veg,Medium,Restaurant: Sitara Grand - Nizami Pakwaan. Area: Banjara Hills. Cuisine: ['Biryani' 'Chinese' 'South Indian' 'North Indian' 'Tandoor']. Budget: Medium. Rating: 3.6. Reviews: 100+ ratings. Diet: Non-Veg. Delivery: 62.0 mins. Address: Hotel Sitara Grand Road Number 12 Banjara Hills Hyderabad.
Lalaji Dilli Wale Chaat,Hyderabad,Kothapet & Dilsukhnagar,--,Too Few Ratings,['Chaat' 'Fast Food' 'Maharashtrian' 'Beverages'],₹300 FOR TWO,66.0,False,Plot No G4 H.no 11-9-82/3 Ramakrishnapuram Kothapet Saroornagar Hyderabad East Zone,Non-Veg,Medium,Restaurant: Lalaji Dilli Wale Chaat. Area: Kothapet & Dilsukhnagar. Cuisine: ['Chaat' 'Fast Food' 'Maharashtrian' 'Beverages']. Budget: Medium. Rating: --. Reviews: Too Few Ratings. Diet: Non-Veg. Delivery: 66.0 mins. Address: Plot No G4 H.no 11-9-82/3 Ramakrishnapuram Kothapet Saroornagar Hyderabad East Zone.
Burger Hubs,Hyderabad,Huda Complex,--,Too Few Ratings,['Desserts' 'Beverages'],₹300 FOR TWO,62.0,False,11-7-15/16Ambedkar NagarRoad No 1(Near govt school) vijaya Ganapathy temple Lane,Non-Veg,Medium,Restaurant: Burger Hubs. Area: Huda Complex. Cuisine: ['Desserts' 'Beverages']. Budget: Medium. Rating: --. Reviews: Too Few Ratings. Diet: Non-Veg. Delivery: 62.0 mins. Address: 11-7-15/16Ambedkar NagarRoad No 1(Near govt school) vijaya Ganapathy temple Lane.
Sampradaya Foods,Hyderabad,Amberpet,4.5,100+ ratings,['Sweets' 'Desserts'],₹450 FOR TWO,40.0,False,HOUSE No 2-2-647 Ground Floor SBI COLONY Bagh Amberpet Hyderabad 500013.,Non-Veg,Medium,Restaurant: Sampradaya Foods. Area: Amberpet. Cuisine: ['Sweets' 'Desserts']. Budget: Medium. Rating: 4.5. Reviews: 100+ ratings. Diet: Non-Veg. Delivery: 40.0 mins. Address: HOUSE No 2-2-647 Ground Floor SBI COLONY Bagh Amberpet Hyderabad 500013..
The Mirchiesz,Hyderabad,Sarvodaya Colony,3.8,100+ ratings,['Chinese' 'Biryani' 'Indian'],₹300 FOR TWO,74.0,False,3-8-441/A plot no.49 suryodaya colony LB Nagar Kismatpur  Rajendranagar Rangareddi Telangana,Non-Veg,Medium,Restaurant: The Mirchiesz. Area: Sarvodaya Colony. Cuisine: ['Chinese' 'Biryani' 'Indian']. Budget: Medium. Rating: 3.8. Reviews: 100+ ratings. Diet: Non-Veg. Delivery: 74.0 mins. Address: 3-8-441/A plot no.49 suryodaya colony LB Nagar Kismatpur  Rajendranagar Rangareddi Telangana.
Krupa Mess & tiffins,Hyderabad,Koti,3.6,500+ ratings,['South Indian'],₹200 FOR TWO,39.0,True,4-1-827/3 Beside Ramakrishna Theater Abids Hyderabad,Veg,Low,Restaurant: Krupa Mess & tiffins. Area: Koti. Cuisine: ['South Indian']. Budget: Low. Rating: 3.6. Reviews: 500+ ratings. Diet: Veg. Delivery: 39.0 mins. Address: 4-1-827/3 Beside Ramakrishna Theater Abids Hyderabad.
Tower Bavarchi Multi Cuisine Restaurant,Hyderabad,New Malakpet,3.2,100+ ratings,['North Indian' 'Chinese' 'Biryani'],₹300 FOR TWO,35.0,False,16-2-741/C/4 NH65 Asmangarh Bank Colony New Malakpet Bank Colony New Malakpet Hyderabad Telangana 500036,Non-Veg,Medium,Restaurant: Tower Bavarchi Multi Cuisine Restaurant. Area: New Malakpet. Cuisine: ['North Indian' 'Chinese' 'Biryani']. Budget: Medium. Rating: 3.2. Reviews: 100+ ratings. Diet: Non-Veg. Delivery: 35.0 mins. Address: 16-2-741/C/4 NH65 Asmangarh Bank Colony New Malakpet Bank Colony New Malakpet Hyderabad Telangana 500036.
Sounds Cheesy,Hyderabad,Toli Chowki,4.1,100+ ratings,['Indian'],₹300 FOR TWO,73.0,False,9-4-62/140/1-A Nizam colony Tolichowki. Near Pasha chicken center behind Limra garden function hall,Non-Veg,Medium,Restaurant: Sounds Cheesy. Area: Toli Chowki. Cuisine: ['Indian']. Budget: Medium. Rating: 4.1. Reviews: 100+ ratings. Diet: Non-Veg. Delivery: 73.0 mins. Address: 9-4-62/140/1-A Nizam colony Tolichowki. Near Pasha chicken center behind Limra garden function hall.
Urban Orient Express,Hyderabad,Uppal,3.6,100+ ratings,['Chinese' 'Thai' 'Seafood' 'Asian'],₹300 FOR TWO,72.0,False,1st Floor Swiggy Access kitchen Chilka Nagar Main Rd Balaji Enclave Beerappagadda Uppal Hyderabad - 500039,Non-Veg,Medium,Restaurant: Urban Orient Express. Area: Uppal. Cuisine: ['Chinese' 'Thai' 'Seafood' 'Asian']. Budget: Medium. Rating: 3.6. Reviews: 100+ ratings. Diet: Non-Veg. Delivery: 72.0 mins. Address: 1st Floor Swiggy Access kitchen Chilka Nagar Main Rd Balaji Enclave Beerappagadda Uppal Hyderabad - 500039.
BISMILLAH HOTEL,Hyderabad,Kavadiguda,3.4,100+ ratings,['South Indian' 'Thalis' 'Beverages'],₹100 FOR TWO,40.0,False,6-4-432/1 Bakaram Inside Rd Musheerabad Bakaram Kavadiguda Hyderabad Telangana 500080 India,Non-Veg,Low,Restaurant: BISMILLAH HOTEL. Area: Kavadiguda. Cuisine: ['South Indian' 'Thalis' 'Beverages']. Budget: Low. Rating: 3.4. Reviews: 100+ ratings. Diet: Non-Veg. Delivery: 40.0 mins. Address: 6-4-432/1 Bakaram Inside Rd Musheerabad Bakaram Kavadiguda Hyderabad Telangana 500080 India.
Rahul Tiffins,Hyderabad,Basheer Bagh,3.7,100+ ratings,['South Indian'],₹150 FOR TWO,34.0,True,Street No-19 Near Vijaya Diagnostic Centre Himayathnagar,Veg,Low,Restaurant: Rahul Tiffins. Area: Basheer Bagh. Cuisine: ['South Indian']. Budget: Low. Rating: 3.7. Reviews: 100+ ratings. Diet: Veg. Delivery: 34.0 mins. Address: Street No-19 Near Vijaya Diagnostic Centre Himayathnagar.
Udupi Park Pure Veg,Hyderabad,Ameerpet,4.1,1000+ ratings,['South Indian'],₹150 FOR TWO,57.0,True,H.No 1-C  Manjeera Square  Opp Old Prime Hospital  Ameerpet  Hyderabad -500038,Veg,Low,Restaurant: Udupi Park Pure Veg. Area: Ameerpet. Cuisine: ['South Indian']. Budget: Low. Rating: 4.1. Reviews: 1000+ ratings. Diet: Veg. Delivery: 57.0 mins. Address: H.No 1-C  Manjeera Square  Opp Old Prime Hospital  Ameerpet  Hyderabad -500038.
Mahalaxmi Tiffin Centre,Hyderabad,Ghansi Bazaar,4.2,100+ ratings,['Indian'],₹200 FOR TWO,42.0,True,Gulzar Houz  Rikab Gunj  Ghansi Bazaar  Hyderabad  Telangana 500066,Veg,Low,Restaurant: Mahalaxmi Tiffin Centre. Area: Ghansi Bazaar. Cuisine: ['Indian']. Budget: Low. Rating: 4.2. Reviews: 100+ ratings. Diet: Veg. Delivery: 42.0 mins. Address: Gulzar Houz  Rikab Gunj  Ghansi Bazaar  Hyderabad  Telangana 500066.
Shah Ghouse Cafe & Restaurant,Hyderabad,Toli Chowki,4,10000+ ratings,['Biryani'  'North Indian'  'Chinese'  'Mughlai'  'Tandoor'],₹350 FOR TWO,63.0,False,Opposite SA Imperial Gardens  Near RTA Office  Tolichowki  Hyderabad,Non-Veg,Medium,Restaurant: Shah Ghouse Cafe & Restaurant. Area: Toli Chowki. Cuisine: ['Biryani'  'North Indian'  'Chinese'  'Mughlai'  'Tandoor']. Budget: Medium. Rating: 4. Reviews: 10000+ ratings. Diet: Non-Veg. Delivery: 63.0 mins. Address: Opposite SA Imperial Gardens  Near RTA Office  Tolichowki  Hyderabad.
Cafe Coffee Day,Hyderabad,Basheer Bagh,4.1,100+ ratings,['Beverages'  'Snacks'  'Desserts'],₹300 FOR TWO,40.0,False,3-6-288/3  Sri Siva Rama Towers  King Koti  HydergudaNear MLA Quarters,Non-Veg,Medium,Restaurant: Cafe Coffee Day. Area: Basheer Bagh. Cuisine: ['Beverages'  'Snacks'  'Desserts']. Budget: Medium. Rating: 4.1. Reviews: 100+ ratings. Diet: Non-Veg. Delivery: 40.0 mins. Address: 3-6-288/3  Sri Siva Rama Towers  King Koti  HydergudaNear MLA Quarters.
Sai Darshini Tiffins,Hyderabad,Ameerpet,4.3,1000+ ratings,['South Indian'],₹150 FOR TWO,59.0,True,Opp: Axis Bank Atm  Vengal Rao Nagar Rd  Hyderabad  Telangana 500038,Veg,Low,Restaurant: Sai Darshini Tiffins. Area: Ameerpet. Cuisine: ['South Indian']. Budget: Low. Rating: 4.3. Reviews: 1000+ ratings. Diet: Veg. Delivery: 59.0 mins. Address: Opp: Axis Bank Atm  Vengal Rao Nagar Rd  Hyderabad  Telangana 500038.
Bheemas Grand,Hyderabad,Banjara Hills,4.1,1000+ ratings,['South Indian'],₹150 FOR TWO,50.0,True,Near Rainbow Children Hospital Opposite Karvy Road no 10 Banjara Hills Hyderabad,Veg,Low,Restaurant: Bheemas Grand. Area: Banjara Hills. Cuisine: ['South Indian']. Budget: Low. Rating: 4.1. Reviews: 1000+ ratings. Diet: Veg. Delivery: 50.0 mins. Address: Near Rainbow Children Hospital Opposite Karvy Road no 10 Banjara Hills Hyderabad.
KALYUG KITCHEN,Hyderabad,Himayath Nagar,--,Too Few Ratings,['South Indian'],₹250 FOR TWO,38.0,True,3-6-69/2/4 Avanti Nagar  Basheer Bagh  Hyderabad  Telangana 500029  India,Veg,Low,Restaurant: KALYUG KITCHEN. Area: Himayath Nagar. Cuisine: ['South Indian']. Budget: Low. Rating: --. Reviews: Too Few Ratings. Diet: Veg. Delivery: 38.0 mins. Address: 3-6-69/2/4 Avanti Nagar  Basheer Bagh  Hyderabad  Telangana 500029  India.
Sai Brundavan Tiffins,Hyderabad,Sanjeeva Reddy Nagar,4.3,1000+ ratings,['South Indian'  'Chinese'],₹200 FOR TWO,66.0,False,Plot 7-1-396/16  BK Guda Road  Beside Venkateswara Swammy Temple  S R Nagar  Hyderabad,Non-Veg,Low,Restaurant: Sai Brundavan Tiffins. Area: Sanjeeva Reddy Nagar. Cuisine: ['South Indian'  'Chinese']. Budget: Low. Rating: 4.3. Reviews: 1000+ ratings. Diet: Non-Veg. Delivery: 66.0 mins. Address: Plot 7-1-396/16  BK Guda Road  Beside Venkateswara Swammy Temple  S R Nagar  Hyderabad.
Burger King,Hyderabad,Himayatnagar,4.2,1000+ ratings,['American'  'Fast Food'],₹350 FOR TWO,35.0,False,Burger King India Pvt Ltd  Unit No. 104 A  105 A  106 & 107  MPM Millennium Mall  GHMC Nos. 3-6-552 to 3-6-558 & 558/1  Himayatnagar Main Road  Himayatnagar  Hyderabad - 500029,Non-Veg,Medium,Restaurant: Burger King. Area: Himayatnagar. Cuisine: ['American'  'Fast Food']. Budget: Medium. Rating: 4.2. Reviews: 1000+ ratings. Diet: Non-Veg. Delivery: 35.0 mins. Address: Burger King India Pvt Ltd  Unit No. 104 A  105 A  106 & 107  MPM Millennium Mall  GHMC Nos. 3-6-552 to 3-6-558 & 558/1  Himayatnagar Main Road  Himayatnagar  Hyderabad - 500029.
Karthikeya Tiffins Pure Veg,Hyderabad,Uppal,4.1,500+ ratings,['South Indian'],₹150 FOR TWO,62.0,True,4-66  Bharath Nagar Near Uppal Bus Stop Uppal,Veg,Low,Restaurant: Karthikeya Tiffins Pure Veg. Area: Uppal. Cuisine: ['South Indian']. Budget: Low. Rating: 4.1. Reviews: 500+ ratings. Diet: Veg. Delivery: 62.0 mins. Address: 4-66  Bharath Nagar Near Uppal Bus Stop Uppal.
Paradise Biryani,Hyderabad,Khairtabad,3.9,100+ ratings,['Biryani'  'North Indian'  'Chinese'],₹400 FOR TWO,48.0,False,Beside Prasads IMAX Multiplex  NTR Gardens  IMAX Road  Khairatabad  Central Secretariat  Khairatabad  Hyderabad  Telangana 500004 :- Company Owned outlet. We  do not have any franchisee,Non-Veg,Medium,Restaurant: Paradise Biryani. Area: Khairtabad. Cuisine: ['Biryani'  'North Indian'  'Chinese']. Budget: Medium. Rating: 3.9. Reviews: 100+ ratings. Diet: Non-Veg. Delivery: 48.0 mins. Address: Beside Prasads IMAX Multiplex  NTR Gardens  IMAX Road  Khairatabad  Central Secretariat  Khairatabad  Hyderabad  Telangana 500004 :- Company Owned outlet. We  do not have any franchisee.
Royal Tiffin Centre,Hyderabad,Koti,3.8,1000+ ratings,['South Indian'],₹150 FOR TWO,32.0,True,Hanuman Tekdi  Abids  Hyderabad  Telangana 500001,Veg,Low,Restaurant: Royal Tiffin Centre. Area: Koti. Cuisine: ['South Indian']. Budget: Low. Rating: 3.8. Reviews: 1000+ ratings. Diet: Veg. Delivery: 32.0 mins. Address: Hanuman Tekdi  Abids  Hyderabad  Telangana 500001.
Aashirvad Tiffins,Hyderabad,Rani Gunj,4.2,500+ ratings,['South Indian'  'Fast Food'  'Chinese'  'Snacks'  'Juices'],₹200 FOR TWO,51.0,True,4 1 129 and 130  Subhash Road  Secunderabad  Hyderabad,Veg,Low,Restaurant: Aashirvad Tiffins. Area: Rani Gunj. Cuisine: ['South Indian'  'Fast Food'  'Chinese'  'Snacks'  'Juices']. Budget: Low. Rating: 4.2. Reviews: 500+ ratings. Diet: Veg. Delivery: 51.0 mins. Address: 4 1 129 and 130  Subhash Road  Secunderabad  Hyderabad.
Rambharose - Bhattad Ki Idli,Hyderabad,Kachiguda,4.2,1000+ ratings,['South Indian'],₹150 FOR TWO,27.0,True,3-3-816  opp ganesh temple  A LANE BESIDE RELAINCE DIGITAL  kutbiguda kachiguda Hyderabad,Veg,Low,Restaurant: Rambharose - Bhattad Ki Idli. Area: Kachiguda. Cuisine: ['South Indian']. Budget: Low. Rating: 4.2. Reviews: 1000+ ratings. Diet: Veg. Delivery: 27.0 mins. Address: 3-3-816  opp ganesh temple  A LANE BESIDE RELAINCE DIGITAL  kutbiguda kachiguda Hyderabad.
ABHIRUCHI SWAGRUHA FOODS,Hyderabad,Ameerpet,4.5,100+ ratings,['Sweets'  'Snacks'],₹250 FOR TWO,62.0,False,Abhiruchi Swagruha Foods  14/A MIGH Sanjeeva Reddy Nagar  Near Karur Vysya Bank 500038,Non-Veg,Low,Restaurant: ABHIRUCHI SWAGRUHA FOODS. Area: Ameerpet. Cuisine: ['Sweets'  'Snacks']. Budget: Low. Rating: 4.5. Reviews: 100+ ratings. Diet: Non-Veg. Delivery: 62.0 mins. Address: Abhiruchi Swagruha Foods  14/A MIGH Sanjeeva Reddy Nagar  Near Karur Vysya Bank 500038.
SSV -Tiffin's and Snacks,Hyderabad,Tarnaka,4.3,100+ ratings,['South Indian'  'Snacks'  'Combo'],₹149 FOR TWO,61.0,True,#12-13-677/69  Street No:1  Ground Floor  Kimtee Colony  Gokul Nagar    Near SBI ATM  Tarnaka  Hyderabad - 500017,Veg,Low,Restaurant: SSV -Tiffin's and Snacks. Area: Tarnaka. Cuisine: ['South Indian'  'Snacks'  'Combo']. Budget: Low. Rating: 4.3. Reviews: 100+ ratings. Diet: Veg. Delivery: 61.0 mins. Address: #12-13-677/69  Street No:1  Ground Floor  Kimtee Colony  Gokul Nagar    Near SBI ATM  Tarnaka  Hyderabad - 500017.
Flavours of Taj Mahal Hotel,Hyderabad,Kalasiguda,4.2,1000+ ratings,['North Indian'  'Chinese'  'Desserts'  'Continental'  'South Indian'],₹300 FOR TWO,57.0,False,Taj Tri Star  Seven Hills  1-1-40  SD Road  Secunderabad.,Non-Veg,Medium,Restaurant: Flavours of Taj Mahal Hotel. Area: Kalasiguda. Cuisine: ['North Indian'  'Chinese'  'Desserts'  'Continental'  'South Indian']. Budget: Medium. Rating: 4.2. Reviews: 1000+ ratings. Diet: Non-Veg. Delivery: 57.0 mins. Address: Taj Tri Star  Seven Hills  1-1-40  SD Road  Secunderabad..
Millet Express,Hyderabad,Kothapet & Dilsukhnagar,4.2,1000+ ratings,['Healthy Food'  'South Indian'],₹200 FOR TWO,54.0,False,#13-1-8/6  Prabhat Nagar  Opp:Madhava Reddy Community Hall  Chaitanyapuri  Dilsukh Nagar  Hyderabad -500060,Non-Veg,Low,Restaurant: Millet Express. Area: Kothapet & Dilsukhnagar. Cuisine: ['Healthy Food'  'South Indian']. Budget: Low. Rating: 4.2. Reviews: 1000+ ratings. Diet: Non-Veg. Delivery: 54.0 mins. Address: #13-1-8/6  Prabhat Nagar  Opp:Madhava Reddy Community Hall  Chaitanyapuri  Dilsukh Nagar  Hyderabad -500060.
Hotel Udupi Home,Hyderabad,Sanjeeva Reddy Nagar,4.1,500+ ratings,['South Indian'],₹150 FOR TWO,60.0,True,No. 25/3RT  S R Nagar Main Road  Sanjeeva Reddy Nagar Office Area  S R Nagar  Hyderabad  Telangana 500038  India,Veg,Low,Restaurant: Hotel Udupi Home. Area: Sanjeeva Reddy Nagar. Cuisine: ['South Indian']. Budget: Low. Rating: 4.1. Reviews: 500+ ratings. Diet: Veg. Delivery: 60.0 mins. Address: No. 25/3RT  S R Nagar Main Road  Sanjeeva Reddy Nagar Office Area  S R Nagar  Hyderabad  Telangana 500038  India.
Ram Ki Bandi,Hyderabad,Abids & Koti,4.1,100+ ratings,['South Indian'],₹300 FOR TWO,28.0,False,first floor  Sabir Building  Malakunta  Abids  Hyderabad  Telangana 500012,Non-Veg,Medium,Restaurant: Ram Ki Bandi. Area: Abids & Koti. Cuisine: ['South Indian']. Budget: Medium. Rating: 4.1. Reviews: 100+ ratings. Diet: Non-Veg. Delivery: 28.0 mins. Address: first floor  Sabir Building  Malakunta  Abids  Hyderabad  Telangana 500012.
Bakers Street,Hyderabad,Murad Nagar,4.2,500+ ratings,['Bakery'  'Continental'],₹250 FOR TWO,49.0,False,460/2  Opposite Andhra Bank  Gudimalkatur Road Mehdipatnam  Hyderabad,Non-Veg,Low,Restaurant: Bakers Street. Area: Murad Nagar. Cuisine: ['Bakery'  'Continental']. Budget: Low. Rating: 4.2. Reviews: 500+ ratings. Diet: Non-Veg. Delivery: 49.0 mins. Address: 460/2  Opposite Andhra Bank  Gudimalkatur Road Mehdipatnam  Hyderabad.
Hotel Suprabhat,Hyderabad,Habsiguda,4.3,1000+ ratings,['South Indian'],₹200 FOR TWO,51.0,True,Habsiguda Main Rd  Near Habsiguda Metro Station  Professors Quarters  Habsiguda  Hyderabad  Telangana 500007,Veg,Low,Restaurant: Hotel Suprabhat. Area: Habsiguda. Cuisine: ['South Indian']. Budget: Low. Rating: 4.3. Reviews: 1000+ ratings. Diet: Veg. Delivery: 51.0 mins. Address: Habsiguda Main Rd  Near Habsiguda Metro Station  Professors Quarters  Habsiguda  Hyderabad  Telangana 500007.
The Good Bowl,Hyderabad,Abids,3.9,50+ ratings,['North Indian'  'Punjabi'  'Biryani'  'Combo'  'Chinese'  'Beverages'  'Desserts'  'Jain'  'Indian'  'Hyderabadi'  'Mughlai'],₹400 FOR TWO,37.0,False,Plot No 5-9-211/201  Chirag Ali Lane  Nampally  Abids  Hyderabad 500001,Non-Veg,Medium,Restaurant: The Good Bowl. Area: Abids. Cuisine: ['North Indian'  'Punjabi'  'Biryani'  'Combo'  'Chinese'  'Beverages'  'Desserts'  'Jain'  'Indian'  'Hyderabadi'  'Mughlai']. Budget: Medium. Rating: 3.9. Reviews: 50+ ratings. Diet: Non-Veg. Delivery: 37.0 mins. Address: Plot No 5-9-211/201  Chirag Ali Lane  Nampally  Abids  Hyderabad 500001.
Pizza Hut,Hyderabad,New Nallakunta,3.7,500+ ratings,['Pizzas'  'Fast Food'],₹350 FOR TWO,46.0,False,Sapphire Foods India Pvt Ltd  Pizza Hut  SPICA Apartments  Flat no 103  203  Municipal Bearing No  2 2 1130  8 8 A1  New Nallakunta  Hyderabad 500044,Non-Veg,Medium,Restaurant: Pizza Hut. Area: New Nallakunta. Cuisine: ['Pizzas'  'Fast Food']. Budget: Medium. Rating: 3.7. Reviews: 500+ ratings. Diet: Non-Veg. Delivery: 46.0 mins. Address: Sapphire Foods India Pvt Ltd  Pizza Hut  SPICA Apartments  Flat no 103  203  Municipal Bearing No  2 2 1130  8 8 A1  New Nallakunta  Hyderabad 500044.
Sri Krishna Sweets,Hyderabad,Shivaji Nagar,4.3,50+ ratings,['Sweets'],₹200 FOR TWO,57.0,True,No 1 1 92  R P Road  secunderabad  500003,Veg,Low,Restaurant: Sri Krishna Sweets. Area: Shivaji Nagar. Cuisine: ['Sweets']. Budget: Low. Rating: 4.3. Reviews: 50+ ratings. Diet: Veg. Delivery: 57.0 mins. Address: No 1 1 92  R P Road  secunderabad  500003.
La Pino'z Pizza,Hyderabad,Banjara Hills,4,1000+ ratings,['Pizzas'],₹300 FOR TWO,56.0,False,The Lounge Road Number 12 8-2-681  Road Number 12 Beside Ratnadeep supermarket  Banjara Hills  Sri Ram Nagar Colony  Banjara Hills  Hyderabad  Telangana 500034,Non-Veg,Medium,Restaurant: La Pino'z Pizza. Area: Banjara Hills. Cuisine: ['Pizzas']. Budget: Medium. Rating: 4. Reviews: 1000+ ratings. Diet: Non-Veg. Delivery: 56.0 mins. Address: The Lounge Road Number 12 8-2-681  Road Number 12 Beside Ratnadeep supermarket  Banjara Hills  Sri Ram Nagar Colony  Banjara Hills  Hyderabad  Telangana 500034.
Scoops,Hyderabad,Venkateshwara Colony,4.4,100+ ratings,['Desserts'  'Ice Cream'  'Chaat'],₹300 FOR TWO,24.0,True,3-5-1001  Narayanguda Rd  Venkateshwara Colony  King Koti  Hyderguda  Hyderabad  Telangana 500095,Veg,Medium,Restaurant: Scoops. Area: Venkateshwara Colony. Cuisine: ['Desserts'  'Ice Cream'  'Chaat']. Budget: Medium. Rating: 4.4. Reviews: 100+ ratings. Diet: Veg. Delivery: 24.0 mins. Address: 3-5-1001  Narayanguda Rd  Venkateshwara Colony  King Koti  Hyderguda  Hyderabad  Telangana 500095.
Vellanki Foods,Hyderabad,Ameerpet,4.4,1000+ ratings,['Sweets'  'Desserts'],₹200 FOR TWO,61.0,False,H.No 7-1-615/A Behind Rahmath Complex  Near Ameerpet 'X' Road  Hyderabad,Non-Veg,Low,Restaurant: Vellanki Foods. Area: Ameerpet. Cuisine: ['Sweets'  'Desserts']. Budget: Low. Rating: 4.4. Reviews: 1000+ ratings. Diet: Non-Veg. Delivery: 61.0 mins. Address: H.No 7-1-615/A Behind Rahmath Complex  Near Ameerpet 'X' Road  Hyderabad.
Lingaiah Hotel,Hyderabad,Asif Nagar,4.5,100+ ratings,['South Indian'],₹200 FOR TWO,33.0,False,12-1-1134 Mallepally sita - rambagh kairthabad-50001  Mallepally Hyderabad,Non-Veg,Low,Restaurant: Lingaiah Hotel. Area: Asif Nagar. Cuisine: ['South Indian']. Budget: Low. Rating: 4.5. Reviews: 100+ ratings. Diet: Non-Veg. Delivery: 33.0 mins. Address: 12-1-1134 Mallepally sita - rambagh kairthabad-50001  Mallepally Hyderabad.
Hotel Sandarshini,Hyderabad,Musheerabad,4,100+ ratings,['North Indian'  'Chinese'  'South Indian'],₹200 FOR TWO,36.0,True,Near Sai Raja Theatre  Musheerabad  Hyderabad,Veg,Low,Restaurant: Hotel Sandarshini. Area: Musheerabad. Cuisine: ['North Indian'  'Chinese'  'South Indian']. Budget: Low. Rating: 4. Reviews: 100+ ratings. Diet: Veg. Delivery: 36.0 mins. Address: Near Sai Raja Theatre  Musheerabad  Hyderabad.
Hotel Shri Raghavendra Pure Veg,Hyderabad,Takara Basthi,4.4,50+ ratings,['South Indian'],₹200 FOR TWO,52.0,True,7-1-407  Ground Floor  Maruthi Veedhi  Monda Market,Veg,Low,Restaurant: Hotel Shri Raghavendra Pure Veg. Area: Takara Basthi. Cuisine: ['South Indian']. Budget: Low. Rating: 4.4. Reviews: 50+ ratings. Diet: Veg. Delivery: 52.0 mins. Address: 7-1-407  Ground Floor  Maruthi Veedhi  Monda Market.
SRI SAI AK TIFFIN CENTRE,Hyderabad,A.S. Rao Nagar & Sainikpuri,4.2,100+ ratings,['Indian'  'South Indian'],₹200 FOR TWO,83.0,False,PLOT NO 161  DR AS RAO NAGAR  ECIL POST KAPRS MANDAL HYDERABAD,Non-Veg,Low,Restaurant: SRI SAI AK TIFFIN CENTRE. Area: A.S. Rao Nagar & Sainikpuri. Cuisine: ['Indian'  'South Indian']. Budget: Low. Rating: 4.2. Reviews: 100+ ratings. Diet: Non-Veg. Delivery: 83.0 mins. Address: PLOT NO 161  DR AS RAO NAGAR  ECIL POST KAPRS MANDAL HYDERABAD.
Breakfast Express,Hyderabad,Himayath Nagar,4.3,100+ ratings,['Continental'  'North Indian'  'South Indian'  'Beverages'],₹200 FOR TWO,33.0,False,H.No. 3-4-802/1  Ground Floor Mahatee Niketan Apartments Barkatpura Hyderabad 500027  Telangana,Non-Veg,Low,Restaurant: Breakfast Express. Area: Himayath Nagar. Cuisine: ['Continental'  'North Indian'  'South Indian'  'Beverages']. Budget: Low. Rating: 4.3. Reviews: 100+ ratings. Diet: Non-Veg. Delivery: 33.0 mins. Address: H.No. 3-4-802/1  Ground Floor Mahatee Niketan Apartments Barkatpura Hyderabad 500027  Telangana.
Haldirams,Hyderabad,Karkhana,4.3,1000+ ratings,['Indian'  'Fast Food'],₹250 FOR TWO,67.0,True,Plot No 12 HACP Colony  Opposite Pulla Reddy Sweets  Vikrampuri  Karkhana  Main Road Secunderabad  Telangana 500026,Veg,Low,Restaurant: Haldirams. Area: Karkhana. Cuisine: ['Indian'  'Fast Food']. Budget: Low. Rating: 4.3. Reviews: 1000+ ratings. Diet: Veg. Delivery: 67.0 mins. Address: Plot No 12 HACP Colony  Opposite Pulla Reddy Sweets  Vikrampuri  Karkhana  Main Road Secunderabad  Telangana 500026.
KFC,Hyderabad,Kachiguda,3.8,20+ ratings,['American'  'Snacks'],₹400 FOR TWO,45.0,False,Shop no 3  Ground Floor located at Ganeriwal Complex  Opp KumarTheater  Main Road Kachiguda  Hyderabad 500027,Non-Veg,Medium,Restaurant: KFC. Area: Kachiguda. Cuisine: ['American'  'Snacks']. Budget: Medium. Rating: 3.8. Reviews: 20+ ratings. Diet: Non-Veg. Delivery: 45.0 mins. Address: Shop no 3  Ground Floor located at Ganeriwal Complex  Opp KumarTheater  Main Road Kachiguda  Hyderabad 500027.
Starbucks Coffee,Hyderabad,Banjara Hills,4.2,500+ ratings,['Beverages'  'Ice Cream'],₹400 FOR TWO,58.0,False,Lower Ground Floor  GVK One  Road Number 1  Banjara Hills  Hyderabad-500034,Non-Veg,Medium,Restaurant: Starbucks Coffee. Area: Banjara Hills. Cuisine: ['Beverages'  'Ice Cream']. Budget: Medium. Rating: 4.2. Reviews: 500+ ratings. Diet: Non-Veg. Delivery: 58.0 mins. Address: Lower Ground Floor  GVK One  Road Number 1  Banjara Hills  Hyderabad-500034.
