name,city,area,avgrating,totalratingsstring,cuisines,costfortwostrings,deliverytime,veg,address,diet,price_level,rag_text
Hotel Indu Deluxe,Hyderabad,Khairtabad,4.9,20+ ratings,['South Indian' 'Biryani'],₹400 FOR TWO,44.0,False,H.No: 6-1-60/A DR No-6 Block No-1 Saifabad Abids Lakdikapul Hyderabad 500004,Non-Veg,Medium,Restaurant: Hotel Indu Deluxe. Area: Khairtabad. Cuisine: ['South Indian' 'Biryani']. Budget: Medium. Rating: 4.9. Reviews: 20+ ratings. Diet: Non-Veg. Delivery: 44.0 mins. Address: H.No: 6-1-60/A DR No-6 Block No-1 Saifabad Abids Lakdikapul Hyderabad 500004.
Huber & Holly,Hyderabad,Himayatnagar,4.2,100+ ratings,['Pizzas' 'Beverages' 'Desserts' 'Ice Cream' 'Italian' 'Pastas'],₹500 FOR TWO,28.0,False,3-6-564 & 3-6-564/1 Himayatnagar  Hyderabad,Non-Veg,Medium,Restaurant: Huber & Holly. Area: Himayatnagar. Cuisine: ['Pizzas' 'Beverages' 'Desserts' 'Ice Cream' 'Italian' 'Pastas']. Budget: Medium. Rating: 4.2. Reviews: 100+ ratings. Diet: Non-Veg. Delivery: 28.0 mins. Address: 3-6-564 & 3-6-564/1 Himayatnagar  Hyderabad.
Keshav Reddy Sweets,Hyderabad,Banjara Hills,4.2,500+ ratings,['Sweets' 'Bakery' 'Desserts' 'Fast Food' 'Street Food' 'Chaat'],₹150 FOR TWO,65.0,False,Pavani Estate Rilif Road Andhra Pradesh Real Estate Green Valley Road No. 2 Banjara Hills Hyderabad,Non-Veg,Low,Restaurant: Keshav Reddy Sweets. Area: Banjara Hills. Cuisine: ['Sweets' 'Bakery' 'Desserts' 'Fast Food' 'Street Food' 'Chaat']. Budget: Low. Rating: 4.2. Reviews: 500+ ratings. Diet: Non-Veg. Delivery: 65.0 mins. Address: Pavani Estate Rilif Road Andhra Pradesh Real Estate Green Valley Road No. 2 Banjara Hills Hyderabad.
Rammy Fast Food,Hyderabad,Adikmet,4,100+ ratings,['Fast Food'],₹200 FOR TWO,35.0,False,1-9-670/A/9 SVES School building Adikmet Road Vidyanagar Hyderabad - 500042,Non-Veg,Low,Restaurant: Rammy Fast Food. Area: Adikmet. Cuisine: ['Fast Food']. Budget: Low. Rating: 4. Reviews: 100+ ratings. Diet: Non-Veg. Delivery: 35.0 mins. Address: 1-9-670/A/9 SVES School building Adikmet Road Vidyanagar Hyderabad - 500042.
Barbeque Nation,Hyderabad,Kiran Nagar,3.4,100+ ratings,['North Indian' 'Chinese' 'Biryani'],₹600 FOR TWO,60.0,False,Unit No.G-3 Ground Floor Vishnavi Onyx-1 no.8 & 9/1/1/15 Kiran Nagar Doctors Colony L. B. Nagar Hyderabad Telangana 500035,Non-Veg,High,Restaurant: Barbeque Nation. Area: Kiran Nagar. Cuisine: ['North Indian' 'Chinese' 'Biryani']. Budget: High. Rating: 3.4. Reviews: 100+ ratings. Diet: Non-Veg. Delivery: 60.0 mins. Address: Unit No.G-3 Ground Floor Vishnavi Onyx-1 no.8 & 9/1/1/15 Kiran Nagar Doctors Colony L. B. Nagar Hyderabad Telangana 500035.
Mini Punjab,Hyderabad,Abids,3.7,500+ ratings,['South Indian' 'North Indian' 'Chinese' 'Punjabi'],₹400 FOR TWO,35.0,True,Mini Punjab 4-1-1228beside Kamineni Hospital Boggulkunta Abids Hyderabad Telangana 500001,Veg,Medium,Restaurant: Mini Punjab. Area: Abids. Cuisine: ['South Indian' 'North Indian' 'Chinese' 'Punjabi']. Budget: Medium. Rating: 3.7. Reviews: 500+ ratings. Diet: Veg. Delivery: 35.0 mins. Address: Mini Punjab 4-1-1228beside Kamineni Hospital Boggulkunta Abids Hyderabad Telangana 500001.
Sri Narsing Bhelpuri & Pav Bhaji (Himayathnagar),Hyderabad,Adarsh Nagar,4.1,100+ ratings,['Chaat' 'Italian'],₹150 FOR TWO,35.0,True,Shop No 7 medison house Hno 5-9-30/c ground floor Hyderabad nursing home laneHImayat Nagar hyderabad,Veg,Low,Restaurant: Sri Narsing Bhelpuri & Pav Bhaji (Himayathnagar). Area: Adarsh Nagar. Cuisine: ['Chaat' 'Italian']. Budget: Low. Rating: 4.1. Reviews: 100+ ratings. Diet: Veg. Delivery: 35.0 mins. Address: Shop No 7 medison house Hno 5-9-30/c ground floor Hyderabad nursing home laneHImayat Nagar hyderabad.
Balaji Vishnu Sweet House,Hyderabad,Abids & Koti,--,Too Few Ratings,['Sweets'],₹150 FOR TWO,29.0,True,Opposite Women's College Bus Stand Esamiya Bazaar Koti Hyderabad,Veg,Low,Restaurant: Balaji Vishnu Sweet House. Area: Abids & Koti. Cuisine: ['Sweets']. Budget: Low. Rating: --. Reviews: Too Few Ratings. Diet: Veg. Delivery: 29.0 mins. Address: Opposite Women's College Bus Stand Esamiya Bazaar Koti Hyderabad.
bake and beans,Hyderabad,Himayath Nagar,--,Too Few Ratings,['Snacks' 'American' 'Pizzas' 'Pastas' 'Beverages'],₹400 FOR TWO,36.0,True,3-6-562/2 Himayat Nagar Rd Himayatnagar Hyderabad Telangana 500029 India,Veg,Medium,Restaurant: bake and beans. Area: Himayath Nagar. Cuisine: ['Snacks' 'American' 'Pizzas' 'Pastas' 'Beverages']. Budget: Medium. Rating: --. Reviews: Too Few Ratings. Diet: Veg. Delivery: 36.0 mins. Address: 3-6-562/2 Himayat Nagar Rd Himayatnagar Hyderabad Telangana 500029 India.
NEW HANDI BIRYANI,Hyderabad,Kachiguda,3.9,20+ ratings,['Chinese' 'Biryani' 'Kebabs' 'South Indian' 'Beverages'],₹200 FOR TWO,29.0,False,3-4-244/1Ground FloorPadmavati Theatre LaneKachigudaHyderabad 500027,Non-Veg,Low,Restaurant: NEW HANDI BIRYANI. Area: Kachiguda. Cuisine: ['Chinese' 'Biryani' 'Kebabs' 'South Indian' 'Beverages']. Budget: Low. Rating: 3.9. Reviews: 20+ ratings. Diet: Non-Veg. Delivery: 29.0 mins. Address: 3-4-244/1Ground FloorPadmavati Theatre LaneKachigudaHyderabad 500027.
Cheesiaano pizza,Hyderabad,Himayatnagar,4,100+ ratings,['Italian' 'Pizzas'],₹300 FOR TWO,34.0,False,H.No. 1-1-336/31 Vivek Nagar Chikkadpally Hyderabad-20.,Non-Veg,Medium,Restaurant: Cheesiaano pizza. Area: Himayatnagar. Cuisine: ['Italian' 'Pizzas']. Budget: Medium. Rating: 4. Reviews: 100+ ratings. Diet: Non-Veg. Delivery: 34.0 mins. Address: H.No. 1-1-336/31 Vivek Nagar Chikkadpally Hyderabad-20..
Hotel Azizia,Hyderabad,Lakdikapul,3.9,50+ ratings,['North Indian' 'Biryani' 'Chinese'],₹300 FOR TWO,31.0,False,Nampalli Railway Station Rd 11-6-252 Nampalli Railway Station Rd Public Gardens Red Hills Nampally Hyderabad Telangana 500457,Non-Veg,Medium,Restaurant: Hotel Azizia. Area: Lakdikapul. Cuisine: ['North Indian' 'Biryani' 'Chinese']. Budget: Medium. Rating: 3.9. Reviews: 50+ ratings. Diet: Non-Veg. Delivery: 31.0 mins. Address: Nampalli Railway Station Rd 11-6-252 Nampalli Railway Station Rd Public Gardens Red Hills Nampally Hyderabad Telangana 500457.
Panda Momos,Hyderabad,Himayath Nagar,--,Too Few Ratings,['Chinese'],₹250 FOR TWO,39.0,False,3-5-885 shop no: g-2 RASFA COMPLEX OLD MLA QUARTERS HIMAYATNAGAR 500029,Non-Veg,Low,Restaurant: Panda Momos. Area: Himayath Nagar. Cuisine: ['Chinese']. Budget: Low. Rating: --. Reviews: Too Few Ratings. Diet: Non-Veg. Delivery: 39.0 mins. Address: 3-5-885 shop no: g-2 RASFA COMPLEX OLD MLA QUARTERS HIMAYATNAGAR 500029.
THE MAHBOOB BIRYANI,Hyderabad,Charminar,--,Too Few Ratings,['Biryani'],₹1500 FOR TWO,38.0,False,16-5-389/32 Farhat Nagar Rd Dabeerpura North Dabeerpura Hyderabad Telangana 500024 India,Non-Veg,Low,Restaurant: THE MAHBOOB BIRYANI. Area: Charminar. Cuisine: ['Biryani']. Budget: Low. Rating: --. Reviews: Too Few Ratings. Diet: Non-Veg. Delivery: 38.0 mins. Address: 16-5-389/32 Farhat Nagar Rd Dabeerpura North Dabeerpura Hyderabad Telangana 500024 India.
Kamat Hotel,Hyderabad,Khairtabad,4.3,1000+ ratings,['North Indian' 'South Indian' 'Fast Food'],₹500 FOR TWO,37.0,True,6-1-60/1 Secretariat Road Near RBI Saifabad Lakdikapul Hyderabad,Veg,Medium,Restaurant: Kamat Hotel. Area: Khairtabad. Cuisine: ['North Indian' 'South Indian' 'Fast Food']. Budget: Medium. Rating: 4.3. Reviews: 1000+ ratings. Diet: Veg. Delivery: 37.0 mins. Address: 6-1-60/1 Secretariat Road Near RBI Saifabad Lakdikapul Hyderabad.
Bombay Kulfis,Hyderabad,Himayatnagar,4.4,20+ ratings,['Ice Cream'],₹100 FOR TWO,29.0,True,3-2-256 road beside famous tailors Old MLA Quarters King Koti Himayatnagar Hyderabad Telangana 500029,Veg,Low,Restaurant: Bombay Kulfis. Area: Himayatnagar. Cuisine: ['Ice Cream']. Budget: Low. Rating: 4.4. Reviews: 20+ ratings. Diet: Veg. Delivery: 29.0 mins. Address: 3-2-256 road beside famous tailors Old MLA Quarters King Koti Himayatnagar Hyderabad Telangana 500029.
Roll Zone,Hyderabad,Himayatnagar,4.1,50+ ratings,['Snacks' 'Fast Food'],₹150 FOR TWO,31.0,False,H.no - 3-6-156/a street number 17 urdhu hall lane himayathnagar,Non-Veg,Low,Restaurant: Roll Zone. Area: Himayatnagar. Cuisine: ['Snacks' 'Fast Food']. Budget: Low. Rating: 4.1. Reviews: 50+ ratings. Diet: Non-Veg. Delivery: 31.0 mins. Address: H.no - 3-6-156/a street number 17 urdhu hall lane himayathnagar.
COMBO STORIES BY 10D EXPRESS,Hyderabad,Banjara Hills,4.1,20+ ratings,['Chinese' 'Indian' 'Thalis' 'North Indian' 'Pan-Asian' 'Oriental' 'Kebabs' 'Tandoor' 'Fast Food' 'Desserts' 'Asian' 'Combo' 'Grill' 'Hyderabadi' 'Lucknowi' 'Mughlai' 'Bowl Company' ' Keventers & more'],₹200 FOR TWO,66.0,False,The joint bar.cafe  Rd Number 8 Zahara Nagar Banjara Hills Hyderabad Telangana 500034,Non-Veg,Low,Restaurant: COMBO STORIES BY 10D EXPRESS. Area: Banjara Hills. Cuisine: ['Chinese' 'Indian' 'Thalis' 'North Indian' 'Pan-Asian' 'Oriental' 'Kebabs' 'Tandoor' 'Fast Food' 'Desserts' 'Asian' 'Combo' 'Grill' 'Hyderabadi' 'Lucknowi' 'Mughlai' 'Bowl Company' ' Keventers & more']. Budget: Low. Rating: 4.1. Reviews: 20+ ratings. Diet: Non-Veg. Delivery: 66.0 mins. Address: The joint bar.cafe  Rd Number 8 Zahara Nagar Banjara Hills Hyderabad Telangana 500034.
Ohri's Uppu,Hyderabad,Banjara Hills,3,20+ ratings,['Andhra' 'South Indian'],₹400 FOR TWO,68.0,False,Ohri's Road Number 12 Fortune Enclave Sri Ram Nagar Colony Banjara Hills Hyderabad Telangana India,Non-Veg,Medium,Restaurant: Ohri's Uppu. Area: Banjara Hills. Cuisine: ['Andhra' 'South Indian']. Budget: Medium. Rating: 3. Reviews: 20+ ratings. Diet: Non-Veg. Delivery: 68.0 mins. Address: Ohri's Road Number 12 Fortune Enclave Sri Ram Nagar Colony Banjara Hills Hyderabad Telangana India.
Viyaala Vaari Vindhu,Hyderabad,Kothapet,4,50+ ratings,['South Indian'],₹300 FOR TWO,58.0,False,PLOT.NO.50 ROAD.NO.3 GREENHILLS COLONY  BESIDE SWARNA KANCHI KOTHAPETTelangana India,Non-Veg,Medium,Restaurant: Viyaala Vaari Vindhu. Area: Kothapet. Cuisine: ['South Indian']. Budget: Medium. Rating: 4. Reviews: 50+ ratings. Diet: Non-Veg. Delivery: 58.0 mins. Address: PLOT.NO.50 ROAD.NO.3 GREENHILLS COLONY  BESIDE SWARNA KANCHI KOTHAPETTelangana India.
Roosterville,Hyderabad,Vijay Nagar Colony,3.7,100+ ratings,['Indian'],₹200 FOR TWO,68.0,False,10-4-76 Bairamalguda Nagarjuna Sagar Main Road opp. AEGIS Gas PumpBeside Savera Bar Hyderabad Telangana 500079,Non-Veg,Low,Restaurant: Roosterville. Area: Vijay Nagar Colony. Cuisine: ['Indian']. Budget: Low. Rating: 3.7. Reviews: 100+ ratings. Diet: Non-Veg. Delivery: 68.0 mins. Address: 10-4-76 Bairamalguda Nagarjuna Sagar Main Road opp. AEGIS Gas PumpBeside Savera Bar Hyderabad Telangana 500079.
RUSHTY REATAURANT CHAT SANDWICH AND JUICE,Hyderabad,Kavadiguda,--,Too Few Ratings,['Fast Food' 'Beverages' 'Juices'],₹150 FOR TWO,51.0,False,Dabholkar Stores StreetNumber 13 Gandhinagar Vigneswar Enclave Indira Nagar Kavadiguda Hyderabad Telangana India,Non-Veg,Low,Restaurant: RUSHTY REATAURANT CHAT SANDWICH AND JUICE. Area: Kavadiguda. Cuisine: ['Fast Food' 'Beverages' 'Juices']. Budget: Low. Rating: --. Reviews: Too Few Ratings. Diet: Non-Veg. Delivery: 51.0 mins. Address: Dabholkar Stores StreetNumber 13 Gandhinagar Vigneswar Enclave Indira Nagar Kavadiguda Hyderabad Telangana India.
Deccan Chef,Hyderabad,Himayath Nagar,--,Too Few Ratings,['Indian'],₹150 FOR TWO,34.0,False,Moazzam Jahi Market 5-5-511 Mukarram Jahi Rd APHB Colony Chandra Vihar Old Kattal Mandi Nampally Hyderabad Telangana 500001 India,Non-Veg,Low,Restaurant: Deccan Chef. Area: Himayath Nagar. Cuisine: ['Indian']. Budget: Low. Rating: --. Reviews: Too Few Ratings. Diet: Non-Veg. Delivery: 34.0 mins. Address: Moazzam Jahi Market 5-5-511 Mukarram Jahi Rd APHB Colony Chandra Vihar Old Kattal Mandi Nampally Hyderabad Telangana 500001 India.
Apsara Ice Creams,Hyderabad,Himayatnagar,4.3,50+ ratings,['Ice Cream' 'Desserts'],₹150 FOR TWO,33.0,True,Himayat Nagar Rd Sai Vihar Advocates Colony Himayatnagar Hyderabad Telangana 500029,Veg,Low,Restaurant: Apsara Ice Creams. Area: Himayatnagar. Cuisine: ['Ice Cream' 'Desserts']. Budget: Low. Rating: 4.3. Reviews: 50+ ratings. Diet: Veg. Delivery: 33.0 mins. Address: Himayat Nagar Rd Sai Vihar Advocates Colony Himayatnagar Hyderabad Telangana 500029.
Pizza Stories,Hyderabad,Ramnas Pura,--,Too Few Ratings,['Pizzas'],₹350 FOR TWO,59.0,False,19-2-11/119/B/3 Bilal Nagar Ramnas Pura Hyderabad Telangana 500053 India,Non-Veg,Medium,Restaurant: Pizza Stories. Area: Ramnas Pura. Cuisine: ['Pizzas']. Budget: Medium. Rating: --. Reviews: Too Few Ratings. Diet: Non-Veg. Delivery: 59.0 mins. Address: 19-2-11/119/B/3 Bilal Nagar Ramnas Pura Hyderabad Telangana 500053 India.
YS Mandi,Hyderabad,Kothapet & Dilsukhnagar,--,Too Few Ratings,['Arabian' 'Kebabs' 'Biryani'],₹400 FOR TWO,44.0,False,16-2-741/C/282 FIRST FLOOR T.V. TOWER X ROAD ASMANGADH MALAKPET Circle No.5 (OldMCH Circle-II) Charminar Hyderabad South Zone Telangana - 500036,Non-Veg,Medium,Restaurant: YS Mandi. Area: Kothapet & Dilsukhnagar. Cuisine: ['Arabian' 'Kebabs' 'Biryani']. Budget: Medium. Rating: --. Reviews: Too Few Ratings. Diet: Non-Veg. Delivery: 44.0 mins. Address: 16-2-741/C/282 FIRST FLOOR T.V. TOWER X ROAD ASMANGADH MALAKPET Circle No.5 (OldMCH Circle-II) Charminar Hyderabad South Zone Telangana - 500036.
Tasty Inn Hyderabadi Biryani,Hyderabad,Nallakunta & Vidyanagar,--,Too Few Ratings,['Biryani' 'Indian' 'Chinese' 'Seafood'],₹250 FOR TWO,43.0,False,plot no 79 mig bathkammakunta bagh amberpet hyderabad 13     500013,Non-Veg,Low,Restaurant: Tasty Inn Hyderabadi Biryani. Area: Nallakunta & Vidyanagar. Cuisine: ['Biryani' 'Indian' 'Chinese' 'Seafood']. Budget: Low. Rating: --. Reviews: Too Few Ratings. Diet: Non-Veg. Delivery: 43.0 mins. Address: plot no 79 mig bathkammakunta bagh amberpet hyderabad 13     500013.
Sindhura East Court,Hyderabad,Jyothi Nagar,3.7,20+ ratings,['North Indian' 'Chinese' 'South Indian' 'Tandoor'],₹300 FOR TWO,65.0,False,House no 10-1-80/3/2/a raghavendra nagar colony karmanghat x road nagarjuna sagar road saroor nagarhyderabad.,Non-Veg,Medium,Restaurant: Sindhura East Court. Area: Jyothi Nagar. Cuisine: ['North Indian' 'Chinese' 'South Indian' 'Tandoor']. Budget: Medium. Rating: 3.7. Reviews: 20+ ratings. Diet: Non-Veg. Delivery: 65.0 mins. Address: House no 10-1-80/3/2/a raghavendra nagar colony karmanghat x road nagarjuna sagar road saroor nagarhyderabad..
Healing Rice Bowls,Hyderabad,Banjara Hills,3.3,20+ ratings,['North Indian'],₹200 FOR TWO,70.0,False,H.No.8-2-616/D/1 Road No - 11 Banjara Hills Hyderabad - 500034.,Non-Veg,Low,Restaurant: Healing Rice Bowls. Area: Banjara Hills. Cuisine: ['North Indian']. Budget: Low. Rating: 3.3. Reviews: 20+ ratings. Diet: Non-Veg. Delivery: 70.0 mins. Address: H.No.8-2-616/D/1 Road No - 11 Banjara Hills Hyderabad - 500034..
EMI Burger,Hyderabad,Nallakunta & Vidyanagar,--,Too Few Ratings,['Snacks' 'Beverages' 'Fast Food'],₹400 FOR TWO,45.0,False,CG36+W44 Vidya Nagar Adikmet Hyderabad Telangana 500044 India,Non-Veg,Medium,Restaurant: EMI Burger. Area: Nallakunta & Vidyanagar. Cuisine: ['Snacks' 'Beverages' 'Fast Food']. Budget: Medium. Rating: --. Reviews: Too Few Ratings. Diet: Non-Veg. Delivery: 45.0 mins. Address: CG36+W44 Vidya Nagar Adikmet Hyderabad Telangana 500044 India.
Express Cafe by Holiday Inn Express,Hyderabad,Khairtabad,--,Too Few Ratings,['Indian' 'Chinese'],₹800 FOR TWO,67.0,False,6-3-563/2nd Floor/A Erramanzil Colony Somajiguda Banjara Hills Hyderabad Telangana 500082,Non-Veg,High,Restaurant: Express Cafe by Holiday Inn Express. Area: Khairtabad. Cuisine: ['Indian' 'Chinese']. Budget: High. Rating: --. Reviews: Too Few Ratings. Diet: Non-Veg. Delivery: 67.0 mins. Address: 6-3-563/2nd Floor/A Erramanzil Colony Somajiguda Banjara Hills Hyderabad Telangana 500082.
Radhe Family Dhaba,Hyderabad,Nallakunta & Vidyanagar,--,Too Few Ratings,['Indian' 'Chinese'],₹300 FOR TWO,41.0,True,1-2-361/27 Street No.6 Beside Hyderabad Study Circle Sub Division HimyatnagarKHAIRATABADHYDERABAD-500029,Veg,Medium,Restaurant: Radhe Family Dhaba. Area: Nallakunta & Vidyanagar. Cuisine: ['Indian' 'Chinese']. Budget: Medium. Rating: --. Reviews: Too Few Ratings. Diet: Veg. Delivery: 41.0 mins. Address: 1-2-361/27 Street No.6 Beside Hyderabad Study Circle Sub Division HimyatnagarKHAIRATABADHYDERABAD-500029.
WarmOven Cake & Desserts,Hyderabad,Banjara Hills,4.2,500+ ratings,['Bakery' 'Desserts' 'Ice Cream'],₹200 FOR TWO,64.0,False,No 8-2-541/A/A/1/3 Flat No 3 1st Floor Chandra Apartments Road 7 Banjara Hills Hyderabad Khairatabad Circle No.17  Hyderabad Central Zone Telangana 500034,Non-Veg,Low,Restaurant: WarmOven Cake & Desserts. Area: Banjara Hills. Cuisine: ['Bakery' 'Desserts' 'Ice Cream']. Budget: Low. Rating: 4.2. Reviews: 500+ ratings. Diet: Non-Veg. Delivery: 64.0 mins. Address: No 8-2-541/A/A/1/3 Flat No 3 1st Floor Chandra Apartments Road 7 Banjara Hills Hyderabad Khairatabad Circle No.17  Hyderabad Central Zone Telangana 500034.
Chickn Wickn,Hyderabad,Banjara Hills,3.9,20+ ratings,['North Indian' 'Chinese' 'Biryani'],₹200 FOR TWO,61.0,False,8-2-626 ROAD NO.11 BANJARA HILLS HYDERABAD-500034,Non-Veg,Low,Restaurant: Chickn Wickn. Area: Banjara Hills. Cuisine: ['North Indian' 'Chinese' 'Biryani']. Budget: Low. Rating: 3.9. Reviews: 20+ ratings. Diet: Non-Veg. Delivery: 61.0 mins. Address: 8-2-626 ROAD NO.11 BANJARA HILLS HYDERABAD-500034.
IQBATAN Restaurant,Hyderabad,Banjara Hills,--,Too Few Ratings,['Arabian' 'Mughlai' 'Indian'],₹500 FOR TWO,57.0,False,IQBATAN Road Number 13 Mithila Nagar Banjara Hills Hyderabad Telangana India,Non-Veg,Medium,Restaurant: IQBATAN Restaurant. Area: Banjara Hills. Cuisine: ['Arabian' 'Mughlai' 'Indian']. Budget: Medium. Rating: --. Reviews: Too Few Ratings. Diet: Non-Veg. Delivery: 57.0 mins. Address: IQBATAN Road Number 13 Mithila Nagar Banjara Hills Hyderabad Telangana India.
Sri Shagun Mithai Vatika,Hyderabad,Himayatnagar,4.3,20+ ratings,['Desserts' 'Sweets'],₹200 FOR TWO,34.0,True,3-6-365/B Opposite StanzaLiberty Himayatnagar Hyderabad,Veg,Low,Restaurant: Sri Shagun Mithai Vatika. Area: Himayatnagar. Cuisine: ['Desserts' 'Sweets']. Budget: Low. Rating: 4.3. Reviews: 20+ ratings. Diet: Veg. Delivery: 34.0 mins. Address: 3-6-365/B Opposite StanzaLiberty Himayatnagar Hyderabad.
WAHH CHAAP,Hyderabad,Himayath Nagar,4.1,500+ ratings,['North Indian' 'Biryani'],₹300 FOR TWO,31.0,True,Wahh chaap zee plaza opposite minerva and west side  beside apsara icecreams,Veg,Medium,Restaurant: WAHH CHAAP. Area: Himayath Nagar. Cuisine: ['North Indian' 'Biryani']. Budget: Medium. Rating: 4.1. Reviews: 500+ ratings. Diet: Veg. Delivery: 31.0 mins. Address: Wahh chaap zee plaza opposite minerva and west side  beside apsara icecreams.
The Dessert Zone,Hyderabad,Banjara Hills,4.1,100+ ratings,['Bakery' 'Desserts' 'Ice Cream' 'Beverages'],₹300 FOR TWO,63.0,False,No 8-2-541/A/A/1/3 Flat No 3 1st Floor Chandra Apartments Road 7 Banjara Hills Hyderabad Khairatabad Circle No.17  Hyderabad Central Zone Telangana 500034,Non-Veg,Medium,Restaurant: The Dessert Zone. Area: Banjara Hills. Cuisine: ['Bakery' 'Desserts' 'Ice Cream' 'Beverages']. Budget: Medium. Rating: 4.1. Reviews: 100+ ratings. Diet: Non-Veg. Delivery: 63.0 mins. Address: No 8-2-541/A/A/1/3 Flat No 3 1st Floor Chandra Apartments Road 7 Banjara Hills Hyderabad Khairatabad Circle No.17  Hyderabad Central Zone Telangana 500034.
The Indiway,Hyderabad,Koti,4.1,100+ ratings,['North Indian' 'Biryani' 'Mughlai' 'Tandoor' 'Snacks'],₹500 FOR TWO,41.0,False,4-1-875 SECOND FLOOR FLAT NO 208 209 LEGEND BLUE HOPES TILAK ROAD ABIDS HYDERABAD Hyderabad Central Zone Telangana-500001,Non-Veg,Medium,Restaurant: The Indiway. Area: Koti. Cuisine: ['North Indian' 'Biryani' 'Mughlai' 'Tandoor' 'Snacks']. Budget: Medium. Rating: 4.1. Reviews: 100+ ratings. Diet: Non-Veg. Delivery: 41.0 mins. Address: 4-1-875 SECOND FLOOR FLAT NO 208 209 LEGEND BLUE HOPES TILAK ROAD ABIDS HYDERABAD Hyderabad Central Zone Telangana-500001.
KHILJIS CASTLE,Hyderabad,Tolichowki,--,Too Few Ratings,['Arabian' 'Snacks' 'Fast Food'],₹250 FOR TWO,78.0,False,9-2-29/84/AHakeempet tolichowki Hyderabad 500008 khairatabad circle np.17 Hyderabad-central zoneTelangana,Non-Veg,Low,Restaurant: KHILJIS CASTLE. Area: Tolichowki. Cuisine: ['Arabian' 'Snacks' 'Fast Food']. Budget: Low. Rating: --. Reviews: Too Few Ratings. Diet: Non-Veg. Delivery: 78.0 mins. Address: 9-2-29/84/AHakeempet tolichowki Hyderabad 500008 khairatabad circle np.17 Hyderabad-central zoneTelangana.
The Cheese Lovers,Hyderabad,Nallakunta & Vidyanagar,--,Too Few Ratings,['Pizzas' 'Beverages' 'Fast Food'],₹280 FOR TWO,43.0,False,CG36+W44 Vidya Nagar Adikmet Hyderabad Telangana 500044 India,Non-Veg,Low,Restaurant: The Cheese Lovers. Area: Nallakunta & Vidyanagar. Cuisine: ['Pizzas' 'Beverages' 'Fast Food']. Budget: Low. Rating: --. Reviews: Too Few Ratings. Diet: Non-Veg. Delivery: 43.0 mins. Address: CG36+W44 Vidya Nagar Adikmet Hyderabad Telangana 500044 India.
FIPOLA GRILL HOUSE,Hyderabad,Kothapet & Dilsukhnagar,--,Too Few Ratings,['Seafood' 'Snacks' 'Grill'],₹400 FOR TWO,65.0,False,DNO 11 9 25 And 26 SAROOR NAGAR X ROAD HYDERABAD 500035 CIRCLE NO 3 LB NAGAR INCLUDING OLD LB NAGAR GADDIANNARAM MUNICIPALITY HYDERABAD EAST ZONE TELANGANA 500035,Non-Veg,Medium,Restaurant: FIPOLA GRILL HOUSE. Area: Kothapet & Dilsukhnagar. Cuisine: ['Seafood' 'Snacks' 'Grill']. Budget: Medium. Rating: --. Reviews: Too Few Ratings. Diet: Non-Veg. Delivery: 65.0 mins. Address: DNO 11 9 25 And 26 SAROOR NAGAR X ROAD HYDERABAD 500035 CIRCLE NO 3 LB NAGAR INCLUDING OLD LB NAGAR GADDIANNARAM MUNICIPALITY HYDERABAD EAST ZONE TELANGANA 500035.
The Shawarma Daddy,Hyderabad,Himayath Nagar,2.2,50+ ratings,['Arabian' 'Continental' 'Snacks'],₹150 FOR TWO,44.0,False,H.No 1-1-379/120 SRT47  On top of Hatsun Daily Store 1st Floor Block No:101 beside Pochamma Thalli Temple Kaman Jawahar Nagar Kavadiguda Hyderabad Telangana 500020 India,Non-Veg,Low,Restaurant: The Shawarma Daddy. Area: Himayath Nagar. Cuisine: ['Arabian' 'Continental' 'Snacks']. Budget: Low. Rating: 2.2. Reviews: 50+ ratings. Diet: Non-Veg. Delivery: 44.0 mins. Address: H.No 1-1-379/120 SRT47  On top of Hatsun Daily Store 1st Floor Block No:101 beside Pochamma Thalli Temple Kaman Jawahar Nagar Kavadiguda Hyderabad Telangana 500020 India.
Blenders & Coolers,Hyderabad,Banjara Hills,--,Too Few Ratings,['Beverages' 'Juices'],₹600 FOR TWO,69.0,False,H. No.8-2- 372 ROAD NO-5 D K BASTHI BANJARA HILLS CIRCLE NO 10 OLD MCH CIRCLE V KHAIRATABAD HYDERABAD CENTRAL ZONE TELANGANA 500034,Non-Veg,High,Restaurant: Blenders & Coolers. Area: Banjara Hills. Cuisine: ['Beverages' 'Juices']. Budget: High. Rating: --. Reviews: Too Few Ratings. Diet: Non-Veg. Delivery: 69.0 mins. Address: H. No.8-2- 372 ROAD NO-5 D K BASTHI BANJARA HILLS CIRCLE NO 10 OLD MCH CIRCLE V KHAIRATABAD HYDERABAD CENTRAL ZONE TELANGANA 500034.
Best Pasta,Hyderabad,Banjara Hills,--,Too Few Ratings,['Pastas'],₹600 FOR TWO,69.0,False,Banjara hills road 5 Deverkunda basti 0pp high ness residency apartments Devera Konda Basti Green Valley Banjara Hills Hyderabad Telangana 500034 India,Non-Veg,High,Restaurant: Best Pasta. Area: Banjara Hills. Cuisine: ['Pastas']. Budget: High. Rating: --. Reviews: Too Few Ratings. Diet: Non-Veg. Delivery: 69.0 mins. Address: Banjara hills road 5 Deverkunda basti 0pp high ness residency apartments Devera Konda Basti Green Valley Banjara Hills Hyderabad Telangana 500034 India.
Bhaijaan's Avenue,Hyderabad,Kothapet & Dilsukhnagar,--,Too Few Ratings,['North Indian' 'Seafood' 'Indian'],₹280 FOR TWO,32.0,False,16-10-76 NH65 Jamal Colony Old Malakpet Hyderabad Telangana 500036 India,Non-Veg,Low,Restaurant: Bhaijaan's Avenue. Area: Kothapet & Dilsukhnagar. Cuisine: ['North Indian' 'Seafood' 'Indian']. Budget: Low. Rating: --. Reviews: Too Few Ratings. Diet: Non-Veg. Delivery: 32.0 mins. Address: 16-10-76 NH65 Jamal Colony Old Malakpet Hyderabad Telangana 500036 India.
K&C Bakers &confectioners,Hyderabad,Narayanguda,4,100+ ratings,['Bakery'],₹200 FOR TWO,30.0,False,Shop 6-907 Beside SBH Bank Hyderabad Street Number 3 Himayath nagar Hyderabad Telangana 500029,Non-Veg,Low,Restaurant: K&C Bakers &confectioners. Area: Narayanguda. Cuisine: ['Bakery']. Budget: Low. Rating: 4. Reviews: 100+ ratings. Diet: Non-Veg. Delivery: 30.0 mins. Address: Shop 6-907 Beside SBH Bank Hyderabad Street Number 3 Himayath nagar Hyderabad Telangana 500029.
Thin Wrap Pizza Co,Hyderabad,Nallakunta & Vidyanagar,--,Too Few Ratings,['Pizzas'],₹400 FOR TWO,43.0,False,CG36+W44 Vidya Nagar Adikmet Hyderabad Telangana 500044 India,Non-Veg,Medium,Restaurant: Thin Wrap Pizza Co. Area: Nallakunta & Vidyanagar. Cuisine: ['Pizzas']. Budget: Medium. Rating: --. Reviews: Too Few Ratings. Diet: Non-Veg. Delivery: 43.0 mins. Address: CG36+W44 Vidya Nagar Adikmet Hyderabad Telangana 500044 India.
Thaaliyan by Phulkaas,Hyderabad,Nallakunta & Vidyanagar,3.8,100+ ratings,['Indian' 'Mughlai'],₹200 FOR TWO,38.0,False,222 Musheerabad Main Rd Balaram Kavadiguda Hyderabad.,Non-Veg,Low,Restaurant: Thaaliyan by Phulkaas. Area: Nallakunta & Vidyanagar. Cuisine: ['Indian' 'Mughlai']. Budget: Low. Rating: 3.8. Reviews: 100+ ratings. Diet: Non-Veg. Delivery: 38.0 mins. Address: 222 Musheerabad Main Rd Balaram Kavadiguda Hyderabad..
Phulkaas,Hyderabad,Hyderabad,3.8,100+ ratings,['North Indian'],₹200 FOR TWO,40.0,False,Spencers Hyper 222 Musheerabad Main Road  Bakaram Kavadiguda Hyderabad-500020,Non-Veg,Low,Restaurant: Phulkaas. Area: Hyderabad. Cuisine: ['North Indian']. Budget: Low. Rating: 3.8. Reviews: 100+ ratings. Diet: Non-Veg. Delivery: 40.0 mins. Address: Spencers Hyper 222 Musheerabad Main Road  Bakaram Kavadiguda Hyderabad-500020.
