name,city,area,avgrating,totalratingsstring,cuisines,costfortwostrings,deliverytime,veg,address,diet,price_level,rag_text
Try Luck,Pune,Koregaon park,--,Too Few Ratings,['North Indian' 'Mughlai' 'Fast Food' 'Chinese'],₹300 FOR TWO,52.0,False,Sr. no 29 Shop no. 02 Near Sadalbaba Darga Deccan college road Sangamwadi 411006,Non-Veg,Medium,Restaurant: Try Luck. Area: Koregaon park. Cuisine: ['North Indian' 'Mughlai' 'Fast Food' 'Chinese']. Budget: Medium. Rating: --. Reviews: Too Few Ratings. Diet: Non-Veg. Delivery: 52.0 mins. Address: Sr. no 29 Shop no. 02 Near Sadalbaba Darga Deccan college road Sangamwadi 411006.
Aaina,Pune,Koregaon park,--,Too Few Ratings,['North Indian' 'Chinese' 'Fast Food' 'Mughlai'],₹300 FOR TWO,52.0,False,Sr. no 29 Shop no. 02 Near Sadalbaba Darga Deccan college road Sangamwadi 411006,Non-Veg,Medium,Restaurant: Aaina. Area: Koregaon park. Cuisine: ['North Indian' 'Chinese' 'Fast Food' 'Mughlai']. Budget: Medium. Rating: --. Reviews: Too Few Ratings. Diet: Non-Veg. Delivery: 52.0 mins. Address: Sr. no 29 Shop no. 02 Near Sadalbaba Darga Deccan college road Sangamwadi 411006.
Mughal Tadka,Pune,Koregaon park,--,Too Few Ratings,['North Indian' 'Fast Food' 'Chinese' 'Mughlai'],₹300 FOR TWO,52.0,False,Sr. no 29 Shop no. 02 Near Sadalbaba Darga Deccan college road Sangamwadi 411006,Non-Veg,Medium,Restaurant: Mughal Tadka. Area: Koregaon park. Cuisine: ['North Indian' 'Fast Food' 'Chinese' 'Mughlai']. Budget: Medium. Rating: --. Reviews: Too Few Ratings. Diet: Non-Veg. Delivery: 52.0 mins. Address: Sr. no 29 Shop no. 02 Near Sadalbaba Darga Deccan college road Sangamwadi 411006.
Al Barkat,Pune,Koregaon park,--,Too Few Ratings,['North Indian' 'Fast Food' 'Chinese' 'Mughlai'],₹300 FOR TWO,52.0,False,Sr. no 29 Shop no. 02 Near Sadalbaba Darga Deccan college road Sangamwadi 411006,Non-Veg,Medium,Restaurant: Al Barkat. Area: Koregaon park. Cuisine: ['North Indian' 'Fast Food' 'Chinese' 'Mughlai']. Budget: Medium. Rating: --. Reviews: Too Few Ratings. Diet: Non-Veg. Delivery: 52.0 mins. Address: Sr. no 29 Shop no. 02 Near Sadalbaba Darga Deccan college road Sangamwadi 411006.
Happy Singh,Pune,Koregaon park,--,Too Few Ratings,['North Indian' 'Fast Food' 'Chinese' 'Mughlai'],₹300 FOR TWO,51.0,False,Sr. no 29 Shop no. 02 Near Sadalbaba Darga Deccan college road Sangamwadi 411006,Non-Veg,Medium,Restaurant: Happy Singh. Area: Koregaon park. Cuisine: ['North Indian' 'Fast Food' 'Chinese' 'Mughlai']. Budget: Medium. Rating: --. Reviews: Too Few Ratings. Diet: Non-Veg. Delivery: 51.0 mins. Address: Sr. no 29 Shop no. 02 Near Sadalbaba Darga Deccan college road Sangamwadi 411006.
Rewar park,Pune,Koregaon park,--,Too Few Ratings,['North Indian' 'Fast Food' 'Chinese' 'Mughlai'],₹300 FOR TWO,52.0,False,Sr. no 29 Shop no. 02 Near Sadalbaba Darga Deccan college road Sangamwadi 411006,Non-Veg,Medium,Restaurant: Rewar park. Area: Koregaon park. Cuisine: ['North Indian' 'Fast Food' 'Chinese' 'Mughlai']. Budget: Medium. Rating: --. Reviews: Too Few Ratings. Diet: Non-Veg. Delivery: 52.0 mins. Address: Sr. no 29 Shop no. 02 Near Sadalbaba Darga Deccan college road Sangamwadi 411006.
CAKE & MORE,Pune,Koregaon Park,--,Too Few Ratings,['Bakery'],₹600 FOR TWO,52.0,True,Plot No 37B 2nd floor Inscape Cowork CLane Ragvilas Society Koregaon Park Pune Maharashtra 411001 India,Veg,High,Restaurant: CAKE & MORE. Area: Koregaon Park. Cuisine: ['Bakery']. Budget: High. Rating: --. Reviews: Too Few Ratings. Diet: Veg. Delivery: 52.0 mins. Address: Plot No 37B 2nd floor Inscape Cowork CLane Ragvilas Society Koregaon Park Pune Maharashtra 411001 India.
The Cheesecake Pops,Pune,Koregaon Park,4.5,50+ ratings,['Desserts' 'Bakery'],₹300 FOR TWO,46.0,False,unit 35 b nalanda rag vilas society KP,Non-Veg,Medium,Restaurant: The Cheesecake Pops. Area: Koregaon Park. Cuisine: ['Desserts' 'Bakery']. Budget: Medium. Rating: 4.5. Reviews: 50+ ratings. Diet: Non-Veg. Delivery: 46.0 mins. Address: unit 35 b nalanda rag vilas society KP.
Iddos,Pune,Kothrud,3.8,100+ ratings,['South Indian'],₹300 FOR TWO,55.0,True,4 NUTAN PRASAD SOCIETY PL NO.7 SHOP NO.4 Kothrud PUNE,Veg,Medium,Restaurant: Iddos. Area: Kothrud. Cuisine: ['South Indian']. Budget: Medium. Rating: 3.8. Reviews: 100+ ratings. Diet: Veg. Delivery: 55.0 mins. Address: 4 NUTAN PRASAD SOCIETY PL NO.7 SHOP NO.4 Kothrud PUNE.
Krazy Cafe,Pune,Kothrud,--,Too Few Ratings,['Fast Food'],₹150 FOR TWO,55.0,True,26 Mayur Colony Karve Road Kothrud Pune,Veg,Low,Restaurant: Krazy Cafe. Area: Kothrud. Cuisine: ['Fast Food']. Budget: Low. Rating: --. Reviews: Too Few Ratings. Diet: Veg. Delivery: 55.0 mins. Address: 26 Mayur Colony Karve Road Kothrud Pune.
Cafe Dreamland,Pune,Kothrud,3.8,50+ ratings,['Desserts' 'Fast Food'],₹400 FOR TWO,48.0,True,Choice group ground floor nearby McDonald's Karishma Chowk Karve Road Kothrud 411 038,Veg,Medium,Restaurant: Cafe Dreamland. Area: Kothrud. Cuisine: ['Desserts' 'Fast Food']. Budget: Medium. Rating: 3.8. Reviews: 50+ ratings. Diet: Veg. Delivery: 48.0 mins. Address: Choice group ground floor nearby McDonald's Karishma Chowk Karve Road Kothrud 411 038.
Prem's,Pune,Koregaon Park,4.2,100+ ratings,['North Indian' 'Chinese' 'Continental' 'Asian' 'Desserts' 'Beverages'],₹1200 FOR TWO,53.0,False,28/2North Main RoadOppLane 3Koregaon ParkPune-411001,Non-Veg,Low,Restaurant: Prem's. Area: Koregaon Park. Cuisine: ['North Indian' 'Chinese' 'Continental' 'Asian' 'Desserts' 'Beverages']. Budget: Low. Rating: 4.2. Reviews: 100+ ratings. Diet: Non-Veg. Delivery: 53.0 mins. Address: 28/2North Main RoadOppLane 3Koregaon ParkPune-411001.
New Aswad Gomantak,Pune,Kothrud,--,Too Few Ratings,['Indian' 'Seafood' 'Biryani' 'Thalis'],₹200 FOR TWO,55.0,False,Warje Karvenagar Ward Office Karve Nagar Pune Maharashtra India,Non-Veg,Low,Restaurant: New Aswad Gomantak. Area: Kothrud. Cuisine: ['Indian' 'Seafood' 'Biryani' 'Thalis']. Budget: Low. Rating: --. Reviews: Too Few Ratings. Diet: Non-Veg. Delivery: 55.0 mins. Address: Warje Karvenagar Ward Office Karve Nagar Pune Maharashtra India.
Sim Sim,Pune,Koregaon park,--,Too Few Ratings,['North Indian' 'Fast Food' 'Chinese' 'Mughlai'],₹300 FOR TWO,52.0,False,Sr. no 29 Shop no. 02 Near Sadalbaba Darga Deccan college road Sangamwadi 411006,Non-Veg,Medium,Restaurant: Sim Sim. Area: Koregaon park. Cuisine: ['North Indian' 'Fast Food' 'Chinese' 'Mughlai']. Budget: Medium. Rating: --. Reviews: Too Few Ratings. Diet: Non-Veg. Delivery: 52.0 mins. Address: Sr. no 29 Shop no. 02 Near Sadalbaba Darga Deccan college road Sangamwadi 411006.
Punjabi Kitchen,Pune,Kothrud,--,Too Few Ratings,['North Indian' 'Indian'],₹250 FOR TWO,56.0,False,Shop no 1 S no 46 3 paud road erandwane besides jahangir hospital 411038,Non-Veg,Low,Restaurant: Punjabi Kitchen. Area: Kothrud. Cuisine: ['North Indian' 'Indian']. Budget: Low. Rating: --. Reviews: Too Few Ratings. Diet: Non-Veg. Delivery: 56.0 mins. Address: Shop no 1 S no 46 3 paud road erandwane besides jahangir hospital 411038.
Maskawala & Co.,Pune,Kothrud,4.4,500+ ratings,['Snacks' 'Biryani' 'Bakery'],₹400 FOR TWO,49.0,False,Shop NO 2s.no. 12/3B Plot No. 2 saket Hpusing Society  kothrud Pune-  411038,Non-Veg,Medium,Restaurant: Maskawala & Co.. Area: Kothrud. Cuisine: ['Snacks' 'Biryani' 'Bakery']. Budget: Medium. Rating: 4.4. Reviews: 500+ ratings. Diet: Non-Veg. Delivery: 49.0 mins. Address: Shop NO 2s.no. 12/3B Plot No. 2 saket Hpusing Society  kothrud Pune-  411038.
PAPACREAM,Pune,Kothrud,5,20+ ratings,['Ice Cream'],₹350 FOR TWO,52.0,False,shop no.4 maji sainik vasahatplnono 49 pd rd post office  Kothrud Pune -411038,Non-Veg,Medium,Restaurant: PAPACREAM. Area: Kothrud. Cuisine: ['Ice Cream']. Budget: Medium. Rating: 5. Reviews: 20+ ratings. Diet: Non-Veg. Delivery: 52.0 mins. Address: shop no.4 maji sainik vasahatplnono 49 pd rd post office  Kothrud Pune -411038.
A1 Restaurant,Pune,Koregaon park,--,Too Few Ratings,['North Indian'],₹300 FOR TWO,52.0,False,Sr. no 29 Shop no. 02 Near Sadalbaba Darga Deccan college road Sangamwadi 411006,Non-Veg,Medium,Restaurant: A1 Restaurant. Area: Koregaon park. Cuisine: ['North Indian']. Budget: Medium. Rating: --. Reviews: Too Few Ratings. Diet: Non-Veg. Delivery: 52.0 mins. Address: Sr. no 29 Shop no. 02 Near Sadalbaba Darga Deccan college road Sangamwadi 411006.
Modern Khichdi,Pune,Kothrud,--,Too Few Ratings,['North Indian'],₹400 FOR TWO,52.0,False,SHOP NO 4 ROHAN CHEMBER SURVEY NO1 KARVE ROAD KOTHRUD PUNE PMC Maharashtra-411038,Non-Veg,Medium,Restaurant: Modern Khichdi. Area: Kothrud. Cuisine: ['North Indian']. Budget: Medium. Rating: --. Reviews: Too Few Ratings. Diet: Non-Veg. Delivery: 52.0 mins. Address: SHOP NO 4 ROHAN CHEMBER SURVEY NO1 KARVE ROAD KOTHRUD PUNE PMC Maharashtra-411038.
Crazy Momos,Pune,Kothrud,4.5,100+ ratings,['Chinese' 'Continental'],₹200 FOR TWO,49.0,False,Shop no:18 Fountain Head opp. Starbucks near Karishma Complex Kothrud Pune       411038,Non-Veg,Low,Restaurant: Crazy Momos. Area: Kothrud. Cuisine: ['Chinese' 'Continental']. Budget: Low. Rating: 4.5. Reviews: 100+ ratings. Diet: Non-Veg. Delivery: 49.0 mins. Address: Shop no:18 Fountain Head opp. Starbucks near Karishma Complex Kothrud Pune       411038.
Meal Bowl,Pune,Kothrud,--,Too Few Ratings,['North Indian' 'Chinese'],₹400 FOR TWO,52.0,False,SHOP NO 4 ROHAN CHEMBER SURVEY NO1 KARVE ROAD KOTHRUD PUNE PMC Maharashtra-411038,Non-Veg,Medium,Restaurant: Meal Bowl. Area: Kothrud. Cuisine: ['North Indian' 'Chinese']. Budget: Medium. Rating: --. Reviews: Too Few Ratings. Diet: Non-Veg. Delivery: 52.0 mins. Address: SHOP NO 4 ROHAN CHEMBER SURVEY NO1 KARVE ROAD KOTHRUD PUNE PMC Maharashtra-411038.
Buddha Paradise,Pune,Koregaon Park,4.6,50+ ratings,['South Indian' 'Fast Food' 'Chinese'],₹250 FOR TWO,49.0,False,Lane C North Road Next to Kasturba Gandhi School Koregaon Park Pune,Non-Veg,Low,Restaurant: Buddha Paradise. Area: Koregaon Park. Cuisine: ['South Indian' 'Fast Food' 'Chinese']. Budget: Low. Rating: 4.6. Reviews: 50+ ratings. Diet: Non-Veg. Delivery: 49.0 mins. Address: Lane C North Road Next to Kasturba Gandhi School Koregaon Park Pune.
COFFEE BOOTH,Pune,Karve Nagar,4.4,20+ ratings,['Beverages'],₹200 FOR TWO,48.0,True,SHOP NO A4/6 POTNIS PARISAR HSG SOCIETY S NO 29/2 KARVE NAGAR KOTHRUD PUNE 411052,Veg,Low,Restaurant: COFFEE BOOTH. Area: Karve Nagar. Cuisine: ['Beverages']. Budget: Low. Rating: 4.4. Reviews: 20+ ratings. Diet: Veg. Delivery: 48.0 mins. Address: SHOP NO A4/6 POTNIS PARISAR HSG SOCIETY S NO 29/2 KARVE NAGAR KOTHRUD PUNE 411052.
Grab Popcorn,Pune,Bibwewadi,--,Too Few Ratings,['Fast Food' 'Chaat' 'Snacks'],₹200 FOR TWO,54.0,False,SR NO- 689/1A/1B ATAL CO OP HOSUING SOCIETY  GROUND FLOOR BIBWEWADI  PUNE -411037,Non-Veg,Low,Restaurant: Grab Popcorn. Area: Bibwewadi. Cuisine: ['Fast Food' 'Chaat' 'Snacks']. Budget: Low. Rating: --. Reviews: Too Few Ratings. Diet: Non-Veg. Delivery: 54.0 mins. Address: SR NO- 689/1A/1B ATAL CO OP HOSUING SOCIETY  GROUND FLOOR BIBWEWADI  PUNE -411037.
Hotel New Zaika,Pune,Koregaon park,--,Too Few Ratings,['North Indian'],₹300 FOR TWO,47.0,False,Sr. no 29 Shop no. 02 Near Sadalbaba Darga Deccan college road Sangamwadi 411006,Non-Veg,Medium,Restaurant: Hotel New Zaika. Area: Koregaon park. Cuisine: ['North Indian']. Budget: Medium. Rating: --. Reviews: Too Few Ratings. Diet: Non-Veg. Delivery: 47.0 mins. Address: Sr. no 29 Shop no. 02 Near Sadalbaba Darga Deccan college road Sangamwadi 411006.
Yenna Dosa,Pune,Bibwewadi,4.5,500+ ratings,['South Indian'],₹300 FOR TWO,55.0,True,Otta 248 Opposite Kothari Blocks Bibvewadi Pune,Veg,Medium,Restaurant: Yenna Dosa. Area: Bibwewadi. Cuisine: ['South Indian']. Budget: Medium. Rating: 4.5. Reviews: 500+ ratings. Diet: Veg. Delivery: 55.0 mins. Address: Otta 248 Opposite Kothari Blocks Bibvewadi Pune.
Billion Burger,Pune,Kothrud,4.3,20+ ratings,['Fast Food' 'American'],₹200 FOR TWO,55.0,False,Shop no 3 Nutan Prasad next to Iddos Rambaug Colony Kothrud Pune Maharashtra 411038,Non-Veg,Low,Restaurant: Billion Burger. Area: Kothrud. Cuisine: ['Fast Food' 'American']. Budget: Low. Rating: 4.3. Reviews: 20+ ratings. Diet: Non-Veg. Delivery: 55.0 mins. Address: Shop no 3 Nutan Prasad next to Iddos Rambaug Colony Kothrud Pune Maharashtra 411038.
POTBHAR BIRYANI HOUSE,Pune,Kothrud,--,Too Few Ratings,['Indian' 'Combo'],₹380 FOR TWO,56.0,False,SR NO-43/15 SHOP NO-17 NAVSAHYADRIPARAM  COMPLEX KARVE NAGARPUNE-411052 Pune PMC  Maharashtra-411052,Non-Veg,Medium,Restaurant: POTBHAR BIRYANI HOUSE. Area: Kothrud. Cuisine: ['Indian' 'Combo']. Budget: Medium. Rating: --. Reviews: Too Few Ratings. Diet: Non-Veg. Delivery: 56.0 mins. Address: SR NO-43/15 SHOP NO-17 NAVSAHYADRIPARAM  COMPLEX KARVE NAGARPUNE-411052 Pune PMC  Maharashtra-411052.
Loafmaster,Pune,Kothrud,--,Too Few Ratings,['Snacks' 'Beverages'],₹300 FOR TWO,62.0,False,Shop No. A-2/8 Potnis Parisar opp. Girija Shankar Vihar Karve Nagar Pune Maharashtra 411052 India,Non-Veg,Medium,Restaurant: Loafmaster. Area: Kothrud. Cuisine: ['Snacks' 'Beverages']. Budget: Medium. Rating: --. Reviews: Too Few Ratings. Diet: Non-Veg. Delivery: 62.0 mins. Address: Shop No. A-2/8 Potnis Parisar opp. Girija Shankar Vihar Karve Nagar Pune Maharashtra 411052 India.
UMIYA KUTCHI DABELI,Pune,Kothrud,--,Too Few Ratings,['Snacks' 'Continental'],₹100 FOR TWO,51.0,False,Shop No8 Ground Floor SR No. 154 Santosh Bhel Maruti Mandir Karve Road Pune,Non-Veg,Low,Restaurant: UMIYA KUTCHI DABELI. Area: Kothrud. Cuisine: ['Snacks' 'Continental']. Budget: Low. Rating: --. Reviews: Too Few Ratings. Diet: Non-Veg. Delivery: 51.0 mins. Address: Shop No8 Ground Floor SR No. 154 Santosh Bhel Maruti Mandir Karve Road Pune.
BOX.72,Pune,Kothrud,--,Too Few Ratings,['Fast Food' 'Chinese' 'Indian'],₹200 FOR TWO,49.0,False,Survey No 17B/6 Shop No 14 Continetal Chember Sangam Press Road Nr Pragait Industrial Estate Kothrud Pune 411038,Non-Veg,Low,Restaurant: BOX.72. Area: Kothrud. Cuisine: ['Fast Food' 'Chinese' 'Indian']. Budget: Low. Rating: --. Reviews: Too Few Ratings. Diet: Non-Veg. Delivery: 49.0 mins. Address: Survey No 17B/6 Shop No 14 Continetal Chember Sangam Press Road Nr Pragait Industrial Estate Kothrud Pune 411038.
Zillionth Bistro,Pune,Kothrud,4.3,100+ ratings,['Chinese' 'Snacks' 'Asian' 'Fast Food'],₹300 FOR TWO,52.0,False,Shop no 3 Nutan Prasad next to Iddos Rambaug Colony Kothrud Pune Maharashtra 411038,Non-Veg,Medium,Restaurant: Zillionth Bistro. Area: Kothrud. Cuisine: ['Chinese' 'Snacks' 'Asian' 'Fast Food']. Budget: Medium. Rating: 4.3. Reviews: 100+ ratings. Diet: Non-Veg. Delivery: 52.0 mins. Address: Shop no 3 Nutan Prasad next to Iddos Rambaug Colony Kothrud Pune Maharashtra 411038.
ROCKET MOMOS,Pune,Koregaon Park,4.5,100+ ratings,['Chinese' 'Beverages'],₹300 FOR TWO,44.0,False,SHOP No. 2 PLOT NO B/17KAMDHENU RAGVILAS SOC SR NO 302 GHORPADI PUNE 411001,Non-Veg,Medium,Restaurant: ROCKET MOMOS. Area: Koregaon Park. Cuisine: ['Chinese' 'Beverages']. Budget: Medium. Rating: 4.5. Reviews: 100+ ratings. Diet: Non-Veg. Delivery: 44.0 mins. Address: SHOP No. 2 PLOT NO B/17KAMDHENU RAGVILAS SOC SR NO 302 GHORPADI PUNE 411001.
La Gustosa,Pune,Kothrud,4.2,100+ ratings,['Italian' 'Fast Food' 'Desserts' 'Pastas'],₹500 FOR TWO,54.0,False,Plot 15 Mayur Colony Tejashree Apartments Rajhans Chowk Kothrud Pune,Non-Veg,Medium,Restaurant: La Gustosa. Area: Kothrud. Cuisine: ['Italian' 'Fast Food' 'Desserts' 'Pastas']. Budget: Medium. Rating: 4.2. Reviews: 100+ ratings. Diet: Non-Veg. Delivery: 54.0 mins. Address: Plot 15 Mayur Colony Tejashree Apartments Rajhans Chowk Kothrud Pune.
Zest Cafe Bar,Pune,Kothrud,4.2,20+ ratings,['Chinese' 'Fast Food'],₹250 FOR TWO,57.0,False,shop no.6 Ideal Chambers Ideal Coloney Paud Road Kothrud Pune 29,Non-Veg,Low,Restaurant: Zest Cafe Bar. Area: Kothrud. Cuisine: ['Chinese' 'Fast Food']. Budget: Low. Rating: 4.2. Reviews: 20+ ratings. Diet: Non-Veg. Delivery: 57.0 mins. Address: shop no.6 Ideal Chambers Ideal Coloney Paud Road Kothrud Pune 29.
Nagpur Saoji Black Curry,Pune,Koregaon Park,--,Too Few Ratings,['Indian'],₹600 FOR TWO,53.0,False,Second floor 24/a C Ln Ragvilas Society Koregaon Park Pune Maharashtra 411001 India,Non-Veg,High,Restaurant: Nagpur Saoji Black Curry. Area: Koregaon Park. Cuisine: ['Indian']. Budget: High. Rating: --. Reviews: Too Few Ratings. Diet: Non-Veg. Delivery: 53.0 mins. Address: Second floor 24/a C Ln Ragvilas Society Koregaon Park Pune Maharashtra 411001 India.
Rap N Roll,Pune,Kothrud,--,Too Few Ratings,['Combo' 'Fast Food' 'Asian' 'Snacks'],₹300 FOR TWO,58.0,False,Shop no 11 krushnprasad society near Bedekar Ganpati Mandir Rambaug Colony Kothrud Pune,Non-Veg,Medium,Restaurant: Rap N Roll. Area: Kothrud. Cuisine: ['Combo' 'Fast Food' 'Asian' 'Snacks']. Budget: Medium. Rating: --. Reviews: Too Few Ratings. Diet: Non-Veg. Delivery: 58.0 mins. Address: Shop no 11 krushnprasad society near Bedekar Ganpati Mandir Rambaug Colony Kothrud Pune.
VEG SUTRA,Pune,Kothrud,--,Too Few Ratings,['North Indian' 'Chinese'],₹400 FOR TWO,52.0,False,SHOP NO 4 ROHAN CHEMBER SURVEY NO1 KARVE ROAD KOTHRUD PUNE PMC Maharashtra-411038,Non-Veg,Medium,Restaurant: VEG SUTRA. Area: Kothrud. Cuisine: ['North Indian' 'Chinese']. Budget: Medium. Rating: --. Reviews: Too Few Ratings. Diet: Non-Veg. Delivery: 52.0 mins. Address: SHOP NO 4 ROHAN CHEMBER SURVEY NO1 KARVE ROAD KOTHRUD PUNE PMC Maharashtra-411038.
WON CHINA,Pune,Kothrud,--,Too Few Ratings,['Chinese'],₹400 FOR TWO,64.0,False,Shop no 11 krushnprasad society near Bedekar Ganpati Mandir Rambaug Colony Kothrud Pune,Non-Veg,Medium,Restaurant: WON CHINA. Area: Kothrud. Cuisine: ['Chinese']. Budget: Medium. Rating: --. Reviews: Too Few Ratings. Diet: Non-Veg. Delivery: 64.0 mins. Address: Shop no 11 krushnprasad society near Bedekar Ganpati Mandir Rambaug Colony Kothrud Pune.
Hotel Shabnam,Pune,Koregaon Park,3.8,20+ ratings,['Indian'],₹300 FOR TWO,61.0,False,Sr No 2 Mother Teresa Nagar Yerwada  Pune Nagar Road &Sangamwadi Pune,Non-Veg,Medium,Restaurant: Hotel Shabnam. Area: Koregaon Park. Cuisine: ['Indian']. Budget: Medium. Rating: 3.8. Reviews: 20+ ratings. Diet: Non-Veg. Delivery: 61.0 mins. Address: Sr No 2 Mother Teresa Nagar Yerwada  Pune Nagar Road &Sangamwadi Pune.
Zaika restaurant,Pune,Koregaon park,--,Too Few Ratings,['North Indian'],₹300 FOR TWO,52.0,False,Sr. no 29 Shop no. 02 Near Sadalbaba Darga Deccan college road Sangamwadi 411006,Non-Veg,Medium,Restaurant: Zaika restaurant. Area: Koregaon park. Cuisine: ['North Indian']. Budget: Medium. Rating: --. Reviews: Too Few Ratings. Diet: Non-Veg. Delivery: 52.0 mins. Address: Sr. no 29 Shop no. 02 Near Sadalbaba Darga Deccan college road Sangamwadi 411006.
Barometer,Pune,Kothrud,4.6,500+ ratings,['Continental' 'Asian' 'Italian' 'North Indian'],₹1100 FOR TWO,57.0,False,Shop 2 Chintamani Pride City Pride Road Paschimanagri Kothrud Pune,Non-Veg,Low,Restaurant: Barometer. Area: Kothrud. Cuisine: ['Continental' 'Asian' 'Italian' 'North Indian']. Budget: Low. Rating: 4.6. Reviews: 500+ ratings. Diet: Non-Veg. Delivery: 57.0 mins. Address: Shop 2 Chintamani Pride City Pride Road Paschimanagri Kothrud Pune.
Hotel Durga,Pune,Kothrud,4.5,500+ ratings,['Fast Food'],₹300 FOR TWO,45.0,False,Malati Complex Ideal Colony Paud Road Kothrud Pune,Non-Veg,Medium,Restaurant: Hotel Durga. Area: Kothrud. Cuisine: ['Fast Food']. Budget: Medium. Rating: 4.5. Reviews: 500+ ratings. Diet: Non-Veg. Delivery: 45.0 mins. Address: Malati Complex Ideal Colony Paud Road Kothrud Pune.
Palavi,Pune,Kothrud,4.2,500+ ratings,['Mughlai' 'North Indian' 'Chinese' 'Fast Food'],₹400 FOR TWO,53.0,True,Plot 10 Rambaug Colony Opposite Anandnagar Park Near Canara Bank Paud Road Kothrud Pune,Veg,Medium,Restaurant: Palavi. Area: Kothrud. Cuisine: ['Mughlai' 'North Indian' 'Chinese' 'Fast Food']. Budget: Medium. Rating: 4.2. Reviews: 500+ ratings. Diet: Veg. Delivery: 53.0 mins. Address: Plot 10 Rambaug Colony Opposite Anandnagar Park Near Canara Bank Paud Road Kothrud Pune.
Lassi Wassi,Pune,Kothrud,4.6,100+ ratings,['Beverages'],₹150 FOR TWO,58.0,False,Shop 4 Vanraji Society MIT College Road Kothrud Pune,Non-Veg,Low,Restaurant: Lassi Wassi. Area: Kothrud. Cuisine: ['Beverages']. Budget: Low. Rating: 4.6. Reviews: 100+ ratings. Diet: Non-Veg. Delivery: 58.0 mins. Address: Shop 4 Vanraji Society MIT College Road Kothrud Pune.
FRIED CHICKEN DESTINATION,Pune,Kothrud,4.2,500+ ratings,['Fast Food' 'American' 'Snacks'],₹200 FOR TWO,58.0,False,SHOP NO 5 KHANDOBA SADAN BUILDING KOTHRUD PUNE - 411029,Non-Veg,Low,Restaurant: FRIED CHICKEN DESTINATION. Area: Kothrud. Cuisine: ['Fast Food' 'American' 'Snacks']. Budget: Low. Rating: 4.2. Reviews: 500+ ratings. Diet: Non-Veg. Delivery: 58.0 mins. Address: SHOP NO 5 KHANDOBA SADAN BUILDING KOTHRUD PUNE - 411029.
SINGH SAAB,Pune,Kothrud,4,500+ ratings,['Indian' 'Snacks' 'Punjabi' 'Street Food' 'Desserts' 'Beverages'],₹200 FOR TWO,52.0,True,S.R.no.129 Plot no.3/2 Ideal Co.op Hsg Society Kothrud Paud Road Pune 411029,Veg,Low,Restaurant: SINGH SAAB. Area: Kothrud. Cuisine: ['Indian' 'Snacks' 'Punjabi' 'Street Food' 'Desserts' 'Beverages']. Budget: Low. Rating: 4. Reviews: 500+ ratings. Diet: Veg. Delivery: 52.0 mins. Address: S.R.no.129 Plot no.3/2 Ideal Co.op Hsg Society Kothrud Paud Road Pune 411029.
Relax Corner Pure Veg,Pune,Bibwewadi,3.9,500+ ratings,['Maharashtrian' 'Punjabi' 'Fast Food'],₹300 FOR TWO,54.0,True,SR  No  681 1B  2 Plus 3 1  Soba Savera SH  No  B 5 6  Bibvewadi Pune,Veg,Medium,Restaurant: Relax Corner Pure Veg. Area: Bibwewadi. Cuisine: ['Maharashtrian' 'Punjabi' 'Fast Food']. Budget: Medium. Rating: 3.9. Reviews: 500+ ratings. Diet: Veg. Delivery: 54.0 mins. Address: SR  No  681 1B  2 Plus 3 1  Soba Savera SH  No  B 5 6  Bibvewadi Pune.
Green Food,Pune,Kothrud,4.3,1000+ ratings,['North Indian' 'South Indian' 'Chinese'],₹300 FOR TWO,50.0,False,Survey 3922 Varad Vinayak Society D P Road Near Yashwant Rao Chavan Natyagruha Kothrud Pune,Non-Veg,Medium,Restaurant: Green Food. Area: Kothrud. Cuisine: ['North Indian' 'South Indian' 'Chinese']. Budget: Medium. Rating: 4.3. Reviews: 1000+ ratings. Diet: Non-Veg. Delivery: 50.0 mins. Address: Survey 3922 Varad Vinayak Society D P Road Near Yashwant Rao Chavan Natyagruha Kothrud Pune.
Khushboo,Pune,Bibwewadi,4.3,50+ ratings,['North Indian' 'Chinese' 'Fast Food'],₹500 FOR TWO,56.0,False,Kondhwa Bibwewadi Road,Non-Veg,Medium,Restaurant: Khushboo. Area: Bibwewadi. Cuisine: ['North Indian' 'Chinese' 'Fast Food']. Budget: Medium. Rating: 4.3. Reviews: 50+ ratings. Diet: Non-Veg. Delivery: 56.0 mins. Address: Kondhwa Bibwewadi Road.
Heaven Pizza And Cafe,Pune,Kothrud,--,Too Few Ratings,['Pizzas'],₹300 FOR TWO,56.0,False,SR NO 129 PLOT NO 2/3 IDEAL COLONY OPP MSEB OFFICE PAUD ROAD KOTHRUD PUNE-411038 District - Pune PMC STATE - Maharashtra,Non-Veg,Medium,Restaurant: Heaven Pizza And Cafe. Area: Kothrud. Cuisine: ['Pizzas']. Budget: Medium. Rating: --. Reviews: Too Few Ratings. Diet: Non-Veg. Delivery: 56.0 mins. Address: SR NO 129 PLOT NO 2/3 IDEAL COLONY OPP MSEB OFFICE PAUD ROAD KOTHRUD PUNE-411038 District - Pune PMC STATE - Maharashtra.
S Kumar Wadewale  Satara Road,Pune,Bibwewadi,--,Too Few Ratings,['Snacks' 'Chaat'],₹100 FOR TWO,65.0,False,Shop no 11 Pushpa Tower satara road Dhankawdipune 411009,Non-Veg,Low,Restaurant: S Kumar Wadewale  Satara Road. Area: Bibwewadi. Cuisine: ['Snacks' 'Chaat']. Budget: Low. Rating: --. Reviews: Too Few Ratings. Diet: Non-Veg. Delivery: 65.0 mins. Address: Shop no 11 Pushpa Tower satara road Dhankawdipune 411009.
Caramella's,Pune,Kothrud,--,Too Few Ratings,['Desserts' 'Bakery'],₹400 FOR TWO,53.0,True,Shop No 129/2/3 Paud Road Opp MSEB Office Rambag Colony,Veg,Medium,Restaurant: Caramella's. Area: Kothrud. Cuisine: ['Desserts' 'Bakery']. Budget: Medium. Rating: --. Reviews: Too Few Ratings. Diet: Veg. Delivery: 53.0 mins. Address: Shop No 129/2/3 Paud Road Opp MSEB Office Rambag Colony.
Cafe Eastwood,Pune,Kothrud,4.4,50+ ratings,['North Indian' 'Continental'],₹700 FOR TWO,58.0,False,Ground Floor Chintamani Pride Near Citypride Kothrud Pune,Non-Veg,High,Restaurant: Cafe Eastwood. Area: Kothrud. Cuisine: ['North Indian' 'Continental']. Budget: High. Rating: 4.4. Reviews: 50+ ratings. Diet: Non-Veg. Delivery: 58.0 mins. Address: Ground Floor Chintamani Pride Near Citypride Kothrud Pune.
Mitran Da junction,Pune,Kothrud,4.2,100+ ratings,['North Indian' 'Chinese'],₹300 FOR TWO,52.0,False,Shop no. 3 Chitralekha Chamber Plot no.14  SR no. 129 Kothrud Paud Road,Non-Veg,Medium,Restaurant: Mitran Da junction. Area: Kothrud. Cuisine: ['North Indian' 'Chinese']. Budget: Medium. Rating: 4.2. Reviews: 100+ ratings. Diet: Non-Veg. Delivery: 52.0 mins. Address: Shop no. 3 Chitralekha Chamber Plot no.14  SR no. 129 Kothrud Paud Road.
Rassaa - Jasa Hava Tassaa,Pune,Karve Nagar,--,Too Few Ratings,['North Indian' 'Indian'],₹500 FOR TWO,61.0,False,D P Road Near Rajaram Bridge Karve Nagar Pune,Non-Veg,Medium,Restaurant: Rassaa - Jasa Hava Tassaa. Area: Karve Nagar. Cuisine: ['North Indian' 'Indian']. Budget: Medium. Rating: --. Reviews: Too Few Ratings. Diet: Non-Veg. Delivery: 61.0 mins. Address: D P Road Near Rajaram Bridge Karve Nagar Pune.
khandeshi tadka,Pune,Kothrud,3.5,20+ ratings,['Maharashtrian'],₹250 FOR TWO,61.0,False,shop no.c-9129 ideal colony plot no.2+3opp.mseb.office Kothrud pune-38,Non-Veg,Low,Restaurant: khandeshi tadka. Area: Kothrud. Cuisine: ['Maharashtrian']. Budget: Low. Rating: 3.5. Reviews: 20+ ratings. Diet: Non-Veg. Delivery: 61.0 mins. Address: shop no.c-9129 ideal colony plot no.2+3opp.mseb.office Kothrud pune-38.
