name,city,area,avgrating,totalratingsstring,cuisines,costfortwostrings,deliverytime,veg,address,diet,price_level,rag_text
Foodies 365,Pune,Kondhwa,--,Too Few Ratings,['Fast Food'],₹200 FOR TWO,71.0,False,Shop No 6 Dhan Mohini Apartment Lane No 20 NIBM Road  Opp. AmbaVaita Society,Non-Veg,Low,Restaurant: Foodies 365. Area: Kondhwa. Cuisine: ['Fast Food']. Budget: Low. Rating: --. Reviews: Too Few Ratings. Diet: Non-Veg. Delivery: 71.0 mins. Address: Shop No 6 Dhan Mohini Apartment Lane No 20 NIBM Road  Opp. AmbaVaita Society.
Hot's chaines & momos,Pune,Kothrud,--,Too Few Ratings,['Chinese' 'Beverages'],₹200 FOR TWO,68.0,False,Shop no 24 srushti complex Guruganesh Nagar Kothrud Pune Maharashtra 411038 India,Non-Veg,Low,Restaurant: Hot's chaines & momos. Area: Kothrud. Cuisine: ['Chinese' 'Beverages']. Budget: Low. Rating: --. Reviews: Too Few Ratings. Diet: Non-Veg. Delivery: 68.0 mins. Address: Shop no 24 srushti complex Guruganesh Nagar Kothrud Pune Maharashtra 411038 India.
TEASHOTS,Pune,Kondhwa,--,Too Few Ratings,['Pizzas' 'Fast Food' 'Snacks' 'Beverages'],₹200 FOR TWO,74.0,False,sr no 18/5/1 CTS no.640 shop no 07 DHanmohino co op housing society komdhwa khurd pune 41104 bibwewadi pune pmc ( maharastra ),Non-Veg,Low,Restaurant: TEASHOTS. Area: Kondhwa. Cuisine: ['Pizzas' 'Fast Food' 'Snacks' 'Beverages']. Budget: Low. Rating: --. Reviews: Too Few Ratings. Diet: Non-Veg. Delivery: 74.0 mins. Address: sr no 18/5/1 CTS no.640 shop no 07 DHanmohino co op housing society komdhwa khurd pune 41104 bibwewadi pune pmc ( maharastra ).
Bring it on Cafe,Pune,Kondhwa,--,Too Few Ratings,['American' 'Bakery' 'Italian'],₹300 FOR TWO,73.0,False,SHOP-06 Dhanmohini Apartments Lane-20 NIBM  Road 411048,Non-Veg,Medium,Restaurant: Bring it on Cafe. Area: Kondhwa. Cuisine: ['American' 'Bakery' 'Italian']. Budget: Medium. Rating: --. Reviews: Too Few Ratings. Diet: Non-Veg. Delivery: 73.0 mins. Address: SHOP-06 Dhanmohini Apartments Lane-20 NIBM  Road 411048.
Blue dragon chinese katta,Pune,Aundh,4,50+ ratings,['Chinese'],₹200 FOR TWO,64.0,False,Shop no 12 chondhe patil road opp to rohan nilay aundh,Non-Veg,Low,Restaurant: Blue dragon chinese katta. Area: Aundh. Cuisine: ['Chinese']. Budget: Low. Rating: 4. Reviews: 50+ ratings. Diet: Non-Veg. Delivery: 64.0 mins. Address: Shop no 12 chondhe patil road opp to rohan nilay aundh.
Mughal Sarai,Pune,Kalyani Nagar,--,Too Few Ratings,['Indian'],₹200 FOR TWO,67.0,False,4 COSMOS BANK EMPLOYEE CO OP HOUSING SOCIETY PLOT NO 31 S NO 209 HISSA NO 4 KALYANI NAGAR YERWADA  PUNE CITY PUNE  PUNE PCMC ward No-17 Pune PCMC Maharashtra 411006,Non-Veg,Low,Restaurant: Mughal Sarai. Area: Kalyani Nagar. Cuisine: ['Indian']. Budget: Low. Rating: --. Reviews: Too Few Ratings. Diet: Non-Veg. Delivery: 67.0 mins. Address: 4 COSMOS BANK EMPLOYEE CO OP HOUSING SOCIETY PLOT NO 31 S NO 209 HISSA NO 4 KALYANI NAGAR YERWADA  PUNE CITY PUNE  PUNE PCMC ward No-17 Pune PCMC Maharashtra 411006.
Cake Paradise,Pune,Kothrud,3.5,20+ ratings,['Desserts' 'Bakery'],₹450 FOR TWO,60.0,False,82/6plot20shiddhivinayk colony sastri nagar kothrud pune,Non-Veg,Medium,Restaurant: Cake Paradise. Area: Kothrud. Cuisine: ['Desserts' 'Bakery']. Budget: Medium. Rating: 3.5. Reviews: 20+ ratings. Diet: Non-Veg. Delivery: 60.0 mins. Address: 82/6plot20shiddhivinayk colony sastri nagar kothrud pune.
Dum Laga Ke Biryani,Pune,Kalyani Nagar,--,Too Few Ratings,['Indian'],₹200 FOR TWO,68.0,False,4 COSMOS BANK EMPLOYEE CO OP HOUSING SOCIETY PLOT NO 31 S NO 209 HISSA NO 4 KALYANI NAGAR YERWADA  PUNE CITY PUNE  PUNE PCMC ward No-17 Pune PCMC Maharashtra 411006,Non-Veg,Low,Restaurant: Dum Laga Ke Biryani. Area: Kalyani Nagar. Cuisine: ['Indian']. Budget: Low. Rating: --. Reviews: Too Few Ratings. Diet: Non-Veg. Delivery: 68.0 mins. Address: 4 COSMOS BANK EMPLOYEE CO OP HOUSING SOCIETY PLOT NO 31 S NO 209 HISSA NO 4 KALYANI NAGAR YERWADA  PUNE CITY PUNE  PUNE PCMC ward No-17 Pune PCMC Maharashtra 411006.
Cafe Bun Maska,Pune,Kondhwa,4,100+ ratings,['Snacks' 'Beverages' 'Chinese'],₹250 FOR TWO,66.0,False,S no-12  Shop No. 4 Near Zam Zam Hotel Kausarbaug Kondhwa Khurd Pune: 411048,Non-Veg,Low,Restaurant: Cafe Bun Maska. Area: Kondhwa. Cuisine: ['Snacks' 'Beverages' 'Chinese']. Budget: Low. Rating: 4. Reviews: 100+ ratings. Diet: Non-Veg. Delivery: 66.0 mins. Address: S no-12  Shop No. 4 Near Zam Zam Hotel Kausarbaug Kondhwa Khurd Pune: 411048.
Cafe Samosa Corner,Pune,Kondhwa,4.4,100+ ratings,['Indian' 'Fast Food' 'Biryani' 'Tandoor' 'Sweets' 'Beverages' 'Street Food'],₹100 FOR TWO,65.0,False,Galaxy A-1/A-2 Next to Hill Mist Harmony Kauserbaugh Kondhwa Pune,Non-Veg,Low,Restaurant: Cafe Samosa Corner. Area: Kondhwa. Cuisine: ['Indian' 'Fast Food' 'Biryani' 'Tandoor' 'Sweets' 'Beverages' 'Street Food']. Budget: Low. Rating: 4.4. Reviews: 100+ ratings. Diet: Non-Veg. Delivery: 65.0 mins. Address: Galaxy A-1/A-2 Next to Hill Mist Harmony Kauserbaugh Kondhwa Pune.
CAFE AL MUHSI,Pune,Kondhwa,--,Too Few Ratings,['Snacks' 'Pizzas' 'Beverages'],₹600 FOR TWO,74.0,False,Shop no 3 Hillmist garden near kausar baugh masjid kondhwa pune 411048,Non-Veg,High,Restaurant: CAFE AL MUHSI. Area: Kondhwa. Cuisine: ['Snacks' 'Pizzas' 'Beverages']. Budget: High. Rating: --. Reviews: Too Few Ratings. Diet: Non-Veg. Delivery: 74.0 mins. Address: Shop no 3 Hillmist garden near kausar baugh masjid kondhwa pune 411048.
Bon Bon Candy Cake Shop,Pune,Kothrud,--,Too Few Ratings,['Bakery'],₹150 FOR TWO,66.0,False,82/6plot20shiddhivinayk colony sastri nagar kothrud pune,Non-Veg,Low,Restaurant: Bon Bon Candy Cake Shop. Area: Kothrud. Cuisine: ['Bakery']. Budget: Low. Rating: --. Reviews: Too Few Ratings. Diet: Non-Veg. Delivery: 66.0 mins. Address: 82/6plot20shiddhivinayk colony sastri nagar kothrud pune.
Fabcafe By Fabindia,Pune,Aundh,4.4,100+ ratings,['North Indian' 'Healthy Food' 'Biryani' 'Beverages'],₹1000 FOR TWO,70.0,False,4th Floor fabindia building M square ITI Roadnext to Saraswat Bank,Non-Veg,Low,Restaurant: Fabcafe By Fabindia. Area: Aundh. Cuisine: ['North Indian' 'Healthy Food' 'Biryani' 'Beverages']. Budget: Low. Rating: 4.4. Reviews: 100+ ratings. Diet: Non-Veg. Delivery: 70.0 mins. Address: 4th Floor fabindia building M square ITI Roadnext to Saraswat Bank.
Taco Bell,Pune,Aundh,3.9,100+ ratings,['Mexican'],₹300 FOR TWO,79.0,False,Taco Bell SF-01 2nd Floor Westend Mall Sector 1 Near Parihar Chowk DP Road Aundh Pune Maharashtra 411007,Non-Veg,Medium,Restaurant: Taco Bell. Area: Aundh. Cuisine: ['Mexican']. Budget: Medium. Rating: 3.9. Reviews: 100+ ratings. Diet: Non-Veg. Delivery: 79.0 mins. Address: Taco Bell SF-01 2nd Floor Westend Mall Sector 1 Near Parihar Chowk DP Road Aundh Pune Maharashtra 411007.
Jalebi Experiment,Pune,Kothrud,3.6,20+ ratings,['Sweets' 'Snacks' 'Indian' 'Rajasthani'],₹500 FOR TWO,65.0,False,Row H.No. 318-319 Satyam Sahakari Society Near Mangal Murti Garden Lane no. 2 Indira Shankar Nagari Kothrud Pune- 411038,Non-Veg,Medium,Restaurant: Jalebi Experiment. Area: Kothrud. Cuisine: ['Sweets' 'Snacks' 'Indian' 'Rajasthani']. Budget: Medium. Rating: 3.6. Reviews: 20+ ratings. Diet: Non-Veg. Delivery: 65.0 mins. Address: Row H.No. 318-319 Satyam Sahakari Society Near Mangal Murti Garden Lane no. 2 Indira Shankar Nagari Kothrud Pune- 411038.
Burger Craft,Pune,Aundh,4.5,100+ ratings,['Fast Food' 'American' 'Beverages' 'Desserts'],₹1000 FOR TWO,66.0,False,Shop no.17 ground floor stellar enclavedp road behind mcdonalds Aundh  Pune 411007,Non-Veg,Low,Restaurant: Burger Craft. Area: Aundh. Cuisine: ['Fast Food' 'American' 'Beverages' 'Desserts']. Budget: Low. Rating: 4.5. Reviews: 100+ ratings. Diet: Non-Veg. Delivery: 66.0 mins. Address: Shop no.17 ground floor stellar enclavedp road behind mcdonalds Aundh  Pune 411007.
CIRCLE OF CRUST,Pune,Mohammed Wadi,4.2,500+ ratings,['Pizzas' 'Beverages' 'Combo' 'Snacks'],₹200 FOR TWO,69.0,False,Shop	No4	Rahul	Residency	Salunkhe	Vihar Road	Pune.	Hadapsar	Pune	PMC	&	Rural(Maharashtra)-411015,Non-Veg,Low,Restaurant: CIRCLE OF CRUST. Area: Mohammed Wadi. Cuisine: ['Pizzas' 'Beverages' 'Combo' 'Snacks']. Budget: Low. Rating: 4.2. Reviews: 500+ ratings. Diet: Non-Veg. Delivery: 69.0 mins. Address: Shop	No4	Rahul	Residency	Salunkhe	Vihar Road	Pune.	Hadapsar	Pune	PMC	&	Rural(Maharashtra)-411015.
Southin Cafe,Pune,Kalyani Nagar,--,Too Few Ratings,['Fast Food' 'Snacks' 'Thalis' 'Beverages'],₹200 FOR TWO,63.0,False,Shop 7 Silver OAK Florina Estate Kalyani Nagar Pune 411006,Non-Veg,Low,Restaurant: Southin Cafe. Area: Kalyani Nagar. Cuisine: ['Fast Food' 'Snacks' 'Thalis' 'Beverages']. Budget: Low. Rating: --. Reviews: Too Few Ratings. Diet: Non-Veg. Delivery: 63.0 mins. Address: Shop 7 Silver OAK Florina Estate Kalyani Nagar Pune 411006.
Raju Uncle's Chole Bhature,Pune,Dhankawadi,4.1,100+ ratings,['Punjabi'],₹150 FOR TWO,65.0,True,Survey 78/1a Bharati Vihar Katraj Pune,Veg,Low,Restaurant: Raju Uncle's Chole Bhature. Area: Dhankawadi. Cuisine: ['Punjabi']. Budget: Low. Rating: 4.1. Reviews: 100+ ratings. Diet: Veg. Delivery: 65.0 mins. Address: Survey 78/1a Bharati Vihar Katraj Pune.
Khichdi Experiment,Pune,Baner,4.5,100+ ratings,['Home Food' 'Indian' 'Healthy Food' 'North Indian' 'Snacks' 'Maharashtrian' 'Sweets' 'South Indian' 'Combo' 'Desserts' 'Beverages' 'Kebabs'],₹250 FOR TWO,60.0,False,Pisces Eservices Pvt Ltd Murkute ComplexNo.4285/2 Taluka-Haveli DistrictPune Near Hotel MahableshwarBaner Pune-411045,Non-Veg,Low,Restaurant: Khichdi Experiment. Area: Baner. Cuisine: ['Home Food' 'Indian' 'Healthy Food' 'North Indian' 'Snacks' 'Maharashtrian' 'Sweets' 'South Indian' 'Combo' 'Desserts' 'Beverages' 'Kebabs']. Budget: Low. Rating: 4.5. Reviews: 100+ ratings. Diet: Non-Veg. Delivery: 60.0 mins. Address: Pisces Eservices Pvt Ltd Murkute ComplexNo.4285/2 Taluka-Haveli DistrictPune Near Hotel MahableshwarBaner Pune-411045.
SOUK by Cafe Arabia,Pune,Salunkhe Vihar,4.3,500+ ratings,['Lebanese' 'Middle Eastern' 'Mediterranean' 'Fast Food'],₹300 FOR TWO,66.0,False,Shop 5 Seashell Apartment Opposite BSNL Telephone Exchange Narayan Annaji Shinde Road Salunkhe Vihar Society Salunkhe Vihar Road Pune,Non-Veg,Medium,Restaurant: SOUK by Cafe Arabia. Area: Salunkhe Vihar. Cuisine: ['Lebanese' 'Middle Eastern' 'Mediterranean' 'Fast Food']. Budget: Medium. Rating: 4.3. Reviews: 500+ ratings. Diet: Non-Veg. Delivery: 66.0 mins. Address: Shop 5 Seashell Apartment Opposite BSNL Telephone Exchange Narayan Annaji Shinde Road Salunkhe Vihar Society Salunkhe Vihar Road Pune.
Hyderabadi Biryani House,Pune,KAUSAR BAUGH NIBM ROAD,2.2,20+ ratings,['Biryani' 'Thalis' 'Indian' 'Desserts'],₹150 FOR TWO,77.0,False,SN-12/10/2SHOP NO-11KAUSAR BAUGH CO OP HSG NR- NIBM ROADKONDHAWA KHURD KONDHAWA KD Bibwewadi Pune PMC  Maharashtra,Non-Veg,Low,Restaurant: Hyderabadi Biryani House. Area: KAUSAR BAUGH NIBM ROAD. Cuisine: ['Biryani' 'Thalis' 'Indian' 'Desserts']. Budget: Low. Rating: 2.2. Reviews: 20+ ratings. Diet: Non-Veg. Delivery: 77.0 mins. Address: SN-12/10/2SHOP NO-11KAUSAR BAUGH CO OP HSG NR- NIBM ROADKONDHAWA KHURD KONDHAWA KD Bibwewadi Pune PMC  Maharashtra.
Pind Da Swad,Pune,Kothrud,4.2,50+ ratings,['Punjabi' 'North Indian' 'Thalis' 'Combo'],₹300 FOR TWO,70.0,False,Shop No. E-26 Kumar Parisar  Near Gandhi Bhavan Rd Kothrud Pune-411029,Non-Veg,Medium,Restaurant: Pind Da Swad. Area: Kothrud. Cuisine: ['Punjabi' 'North Indian' 'Thalis' 'Combo']. Budget: Medium. Rating: 4.2. Reviews: 50+ ratings. Diet: Non-Veg. Delivery: 70.0 mins. Address: Shop No. E-26 Kumar Parisar  Near Gandhi Bhavan Rd Kothrud Pune-411029.
Basilio,Pune,Aundh,--,Too Few Ratings,['Italian'],₹500 FOR TWO,85.0,False,shop no 2 near gaikwad petrol pump opp chitale bandu,Non-Veg,Medium,Restaurant: Basilio. Area: Aundh. Cuisine: ['Italian']. Budget: Medium. Rating: --. Reviews: Too Few Ratings. Diet: Non-Veg. Delivery: 85.0 mins. Address: shop no 2 near gaikwad petrol pump opp chitale bandu.
Kwality Family Resto,Pune,Kalyani Nagar,3.9,100+ ratings,['North Indian' 'Seafood' 'Chinese' 'Continental' 'Biryani'],₹500 FOR TWO,60.0,False,Chinaar Building  Florina Estate  Near Mulik Ground  Kalyani Nagar  Pune,Non-Veg,Medium,Restaurant: Kwality Family Resto. Area: Kalyani Nagar. Cuisine: ['North Indian' 'Seafood' 'Chinese' 'Continental' 'Biryani']. Budget: Medium. Rating: 3.9. Reviews: 100+ ratings. Diet: Non-Veg. Delivery: 60.0 mins. Address: Chinaar Building  Florina Estate  Near Mulik Ground  Kalyani Nagar  Pune.
Sub Culture,Pune,Aundh,--,Too Few Ratings,['Fast Food' 'Snacks' 'Ice Cream' 'Juices'],₹400 FOR TWO,71.0,False,Shop No-4 Sr No -156/1B/1Building  CBageshree Ragdari Pune Aundh   Aundh Pune PMC Maharashtra-411007,Non-Veg,Medium,Restaurant: Sub Culture. Area: Aundh. Cuisine: ['Fast Food' 'Snacks' 'Ice Cream' 'Juices']. Budget: Medium. Rating: --. Reviews: Too Few Ratings. Diet: Non-Veg. Delivery: 71.0 mins. Address: Shop No-4 Sr No -156/1B/1Building  CBageshree Ragdari Pune Aundh   Aundh Pune PMC Maharashtra-411007.
LOST HEAVEN,Pune,Aundh,--,Too Few Ratings,['Chinese' 'Kebabs'],₹300 FOR TWO,73.0,False,PLOT NO 13 SR NO 157 AUNDH PUNE 411007 AUNDH PUNE PMC(MAHARASHTRA) 411007 Maharashtra,Non-Veg,Medium,Restaurant: LOST HEAVEN. Area: Aundh. Cuisine: ['Chinese' 'Kebabs']. Budget: Medium. Rating: --. Reviews: Too Few Ratings. Diet: Non-Veg. Delivery: 73.0 mins. Address: PLOT NO 13 SR NO 157 AUNDH PUNE 411007 AUNDH PUNE PMC(MAHARASHTRA) 411007 Maharashtra.
Kareem's,Pune,Wanowrie,3.8,100+ ratings,['Mughlai' 'North Indian' 'Maharashtrian' 'Biryani' 'Kebabs' 'Tandoor' 'Beverages'],₹250 FOR TWO,59.0,False,Shop no 3Bhagwat SankulOpp Lonkar GardenNext to EatsomeSalunke Vihar Road,Non-Veg,Low,Restaurant: Kareem's. Area: Wanowrie. Cuisine: ['Mughlai' 'North Indian' 'Maharashtrian' 'Biryani' 'Kebabs' 'Tandoor' 'Beverages']. Budget: Low. Rating: 3.8. Reviews: 100+ ratings. Diet: Non-Veg. Delivery: 59.0 mins. Address: Shop no 3Bhagwat SankulOpp Lonkar GardenNext to EatsomeSalunke Vihar Road.
Mumma's Food,Pune,Kothrud,--,Too Few Ratings,['Indian' 'Sweets'],₹300 FOR TWO,70.0,True,Row H.No. 318-319 Satyam Sahakari Society Near Mangal Murti Garden Lane no. 2 Indira Shankar Nagari Kothrud Pune- 411038,Veg,Medium,Restaurant: Mumma's Food. Area: Kothrud. Cuisine: ['Indian' 'Sweets']. Budget: Medium. Rating: --. Reviews: Too Few Ratings. Diet: Veg. Delivery: 70.0 mins. Address: Row H.No. 318-319 Satyam Sahakari Society Near Mangal Murti Garden Lane no. 2 Indira Shankar Nagari Kothrud Pune- 411038.
Paper Lantern,Pune,Aundh,4.3,20+ ratings,['Asian'],₹400 FOR TWO,73.0,False,SR NO 137 138GAIKWAD HOUSEGAIKWAD NAGARAUNDH PUNE,Non-Veg,Medium,Restaurant: Paper Lantern. Area: Aundh. Cuisine: ['Asian']. Budget: Medium. Rating: 4.3. Reviews: 20+ ratings. Diet: Non-Veg. Delivery: 73.0 mins. Address: SR NO 137 138GAIKWAD HOUSEGAIKWAD NAGARAUNDH PUNE.
Hotel mawalaj,Pune,Bibwewadi,--,Too Few Ratings,['Indian' 'Thalis'],₹550 FOR TWO,76.0,False,Sr no 658 Shivraj Nagar Bibwewadi Pune Maharashtra 411037 India,Non-Veg,Medium,Restaurant: Hotel mawalaj. Area: Bibwewadi. Cuisine: ['Indian' 'Thalis']. Budget: Medium. Rating: --. Reviews: Too Few Ratings. Diet: Non-Veg. Delivery: 76.0 mins. Address: Sr no 658 Shivraj Nagar Bibwewadi Pune Maharashtra 411037 India.
Hotel Chandralok,Pune,Dhankawadi,--,Too Few Ratings,['Chinese' 'Snacks'],₹200 FOR TWO,67.0,False,Mohan nagar Kamaldeep angan society shop no 11 dhankawadi,Non-Veg,Low,Restaurant: Hotel Chandralok. Area: Dhankawadi. Cuisine: ['Chinese' 'Snacks']. Budget: Low. Rating: --. Reviews: Too Few Ratings. Diet: Non-Veg. Delivery: 67.0 mins. Address: Mohan nagar Kamaldeep angan society shop no 11 dhankawadi.
The Bounty Sizzlers,Pune,Kalyani Nagar,3.9,20+ ratings,['Continental'],₹600 FOR TWO,60.0,False,Landmark Garden Shop no 1415 & 16 Rd Number 9 Kalyani Nagar Pune Maharashtra 411078 India,Non-Veg,High,Restaurant: The Bounty Sizzlers. Area: Kalyani Nagar. Cuisine: ['Continental']. Budget: High. Rating: 3.9. Reviews: 20+ ratings. Diet: Non-Veg. Delivery: 60.0 mins. Address: Landmark Garden Shop no 1415 & 16 Rd Number 9 Kalyani Nagar Pune Maharashtra 411078 India.
Ganga Chinese centre,Pune,Bopodi,--,Too Few Ratings,['Chinese'],₹150 FOR TWO,63.0,False,Bhau Patil Road Anand Nagar Bopodi Pune Maharashtra India,Non-Veg,Low,Restaurant: Ganga Chinese centre. Area: Bopodi. Cuisine: ['Chinese']. Budget: Low. Rating: --. Reviews: Too Few Ratings. Diet: Non-Veg. Delivery: 63.0 mins. Address: Bhau Patil Road Anand Nagar Bopodi Pune Maharashtra India.
Darshini,Pune,Aundh,4.1,20+ ratings,['South Indian'],₹200 FOR TWO,67.0,True,Shop 2 Yashashree Apartments Gaikwad Nagar Aundh Pune,Veg,Low,Restaurant: Darshini. Area: Aundh. Cuisine: ['South Indian']. Budget: Low. Rating: 4.1. Reviews: 20+ ratings. Diet: Veg. Delivery: 67.0 mins. Address: Shop 2 Yashashree Apartments Gaikwad Nagar Aundh Pune.
Cafe PeterDonuts,Pune,Aundh,4.1,50+ ratings,['Continental' 'Desserts'],₹400 FOR TWO,71.0,False,1st Floor HPCL Petrol Pump Gaikwad Nagar Aundh,Non-Veg,Medium,Restaurant: Cafe PeterDonuts. Area: Aundh. Cuisine: ['Continental' 'Desserts']. Budget: Medium. Rating: 4.1. Reviews: 50+ ratings. Diet: Non-Veg. Delivery: 71.0 mins. Address: 1st Floor HPCL Petrol Pump Gaikwad Nagar Aundh.
Sukhi De Parathe,Pune,Kothrud,--,Too Few Ratings,['North Indian' 'Chinese' 'Combo'],₹150 FOR TWO,73.0,False,Shop No. E-26 Kumar ParisarNear Gandhi Bhavan RoadKothrud Pune Maharashtra 411029,Non-Veg,Low,Restaurant: Sukhi De Parathe. Area: Kothrud. Cuisine: ['North Indian' 'Chinese' 'Combo']. Budget: Low. Rating: --. Reviews: Too Few Ratings. Diet: Non-Veg. Delivery: 73.0 mins. Address: Shop No. E-26 Kumar ParisarNear Gandhi Bhavan RoadKothrud Pune Maharashtra 411029.
Hungry punjabi,Pune,Wanowrie,--,Too Few Ratings,['Indian' 'Chinese'],₹500 FOR TWO,86.0,False,Mohit Highland off. Salunke Vihar Road Kondhwa Pune Maharashtra 411048 India,Non-Veg,Medium,Restaurant: Hungry punjabi. Area: Wanowrie. Cuisine: ['Indian' 'Chinese']. Budget: Medium. Rating: --. Reviews: Too Few Ratings. Diet: Non-Veg. Delivery: 86.0 mins. Address: Mohit Highland off. Salunke Vihar Road Kondhwa Pune Maharashtra 411048 India.
Crazy momos,Pune,Aundh,4.2,50+ ratings,['Fast Food' 'Beverages'],₹200 FOR TWO,63.0,False,S NO. 157 PLOT NO. 14 SHOP NO. S1 S6 AND S7 VAISHNAVI APARTMENT AUNDH PUNE   411007,Non-Veg,Low,Restaurant: Crazy momos. Area: Aundh. Cuisine: ['Fast Food' 'Beverages']. Budget: Low. Rating: 4.2. Reviews: 50+ ratings. Diet: Non-Veg. Delivery: 63.0 mins. Address: S NO. 157 PLOT NO. 14 SHOP NO. S1 S6 AND S7 VAISHNAVI APARTMENT AUNDH PUNE   411007.
S & B the cake factory,Pune,Kothrud,--,Too Few Ratings,['Desserts' 'Bakery'],₹450 FOR TWO,62.0,False,82/6plot20shiddhivinayk colony sastri nagar kothrud pune,Non-Veg,Medium,Restaurant: S & B the cake factory. Area: Kothrud. Cuisine: ['Desserts' 'Bakery']. Budget: Medium. Rating: --. Reviews: Too Few Ratings. Diet: Non-Veg. Delivery: 62.0 mins. Address: 82/6plot20shiddhivinayk colony sastri nagar kothrud pune.
Ori Story - Chinese & Oriental,Pune,Kalyani Nagar,--,Too Few Ratings,['Chinese' 'Oriental' 'Fast Food' 'Combo'],₹300 FOR TWO,70.0,False,SR.NO 16/1MULIK CAPITALKALYANI NAGARPUNE411014PUNE NAGAR ROAD AND SANGAMWADIPUNE PMC(MAHARASHTRA)-411014,Non-Veg,Medium,Restaurant: Ori Story - Chinese & Oriental. Area: Kalyani Nagar. Cuisine: ['Chinese' 'Oriental' 'Fast Food' 'Combo']. Budget: Medium. Rating: --. Reviews: Too Few Ratings. Diet: Non-Veg. Delivery: 70.0 mins. Address: SR.NO 16/1MULIK CAPITALKALYANI NAGARPUNE411014PUNE NAGAR ROAD AND SANGAMWADIPUNE PMC(MAHARASHTRA)-411014.
Let's Order Chinese,Pune,Kothrud,--,Too Few Ratings,['Chinese' 'Pan-Asian' 'Nepalese' 'Fast Food' 'Combo' 'Tibetan'],₹250 FOR TWO,67.0,False,Shop No. E-26 Kumar Parisar  Near Gandhi Bhavan Rd Kothrud Pune  Maharashtra 411029,Non-Veg,Low,Restaurant: Let's Order Chinese. Area: Kothrud. Cuisine: ['Chinese' 'Pan-Asian' 'Nepalese' 'Fast Food' 'Combo' 'Tibetan']. Budget: Low. Rating: --. Reviews: Too Few Ratings. Diet: Non-Veg. Delivery: 67.0 mins. Address: Shop No. E-26 Kumar Parisar  Near Gandhi Bhavan Rd Kothrud Pune  Maharashtra 411029.
HOW'S THE BOWL,Pune,Kothrud,3.6,20+ ratings,['North Indian' 'Punjabi' 'Chinese' 'Biryani' 'Seafood' 'Combo' 'Desserts' 'Beverages'],₹150 FOR TWO,67.0,False,Shop No. E-26 Kumar Parisar  Near Gandhi Bhavan Rd Kothrud Pune  Maharashtra 411029,Non-Veg,Low,Restaurant: HOW'S THE BOWL. Area: Kothrud. Cuisine: ['North Indian' 'Punjabi' 'Chinese' 'Biryani' 'Seafood' 'Combo' 'Desserts' 'Beverages']. Budget: Low. Rating: 3.6. Reviews: 20+ ratings. Diet: Non-Veg. Delivery: 67.0 mins. Address: Shop No. E-26 Kumar Parisar  Near Gandhi Bhavan Rd Kothrud Pune  Maharashtra 411029.
Ya Habibi Fatayer,Pune,Kondhwa,--,Too Few Ratings,['Arabian'],₹400 FOR TWO,74.0,False,Shop 62 Brahma Majestic Kausar Baug NIBM Road Pune,Non-Veg,Medium,Restaurant: Ya Habibi Fatayer. Area: Kondhwa. Cuisine: ['Arabian']. Budget: Medium. Rating: --. Reviews: Too Few Ratings. Diet: Non-Veg. Delivery: 74.0 mins. Address: Shop 62 Brahma Majestic Kausar Baug NIBM Road Pune.
The Juicy Hub,Pune,Anand Nagar,--,Too Few Ratings,['Beverages' 'Fast Food'],₹250 FOR TWO,70.0,True,Shop no.11 Kiara B Society Near Sinhgad Road Police Station Suncity road Anandnagar Sinhgad road Pune-411051.,Veg,Low,Restaurant: The Juicy Hub. Area: Anand Nagar. Cuisine: ['Beverages' 'Fast Food']. Budget: Low. Rating: --. Reviews: Too Few Ratings. Diet: Veg. Delivery: 70.0 mins. Address: Shop no.11 Kiara B Society Near Sinhgad Road Police Station Suncity road Anandnagar Sinhgad road Pune-411051..
Keventers Ice Cream,Pune,Baner,3.9,20+ ratings,['Beverages' 'Ice Cream' 'Desserts'],₹300 FOR TWO,62.0,False,SALUNKE VIHAR PUNEGF S NO 62/12SHOP NO 52D WINGGIRMEHE WANAWORIEPUNEMAHARASHTRA,Non-Veg,Medium,Restaurant: Keventers Ice Cream. Area: Baner. Cuisine: ['Beverages' 'Ice Cream' 'Desserts']. Budget: Medium. Rating: 3.9. Reviews: 20+ ratings. Diet: Non-Veg. Delivery: 62.0 mins. Address: SALUNKE VIHAR PUNEGF S NO 62/12SHOP NO 52D WINGGIRMEHE WANAWORIEPUNEMAHARASHTRA.
Biryani Express 100% Home Made,Pune,Kothrud,3.9,50+ ratings,['Biryani'],₹200 FOR TWO,76.0,False,Sr. No. 79/ 10. Saiganesh Villa  Pooja Park road  Eklavya college chowk  Kothrud  Pune  karve road Pune Pmc  Maharashtra 411038,Non-Veg,Low,Restaurant: Biryani Express 100% Home Made. Area: Kothrud. Cuisine: ['Biryani']. Budget: Low. Rating: 3.9. Reviews: 50+ ratings. Diet: Non-Veg. Delivery: 76.0 mins. Address: Sr. No. 79/ 10. Saiganesh Villa  Pooja Park road  Eklavya college chowk  Kothrud  Pune  karve road Pune Pmc  Maharashtra 411038.
KALANDINI CHINESE,Pune,Sinhgad Road,--,Too Few Ratings,['Chinese'],₹220 FOR TWO,70.0,False,SHOP NO 33 GANGA BHAGYODAY\\r\\nCOMMERCIAL COMPLEX BUILDING D1\\r\\nSINHGAD ROAD Dhanakawadi Pune PMC\\r\\nMaharashtra - 411041,Non-Veg,Low,Restaurant: KALANDINI CHINESE. Area: Sinhgad Road. Cuisine: ['Chinese']. Budget: Low. Rating: --. Reviews: Too Few Ratings. Diet: Non-Veg. Delivery: 70.0 mins. Address: SHOP NO 33 GANGA BHAGYODAY\\r\\nCOMMERCIAL COMPLEX BUILDING D1\\r\\nSINHGAD ROAD Dhanakawadi Pune PMC\\r\\nMaharashtra - 411041.
Healthycious,Pune,Sinhgad Road,--,Too Few Ratings,['Fast Food' 'Salads' 'Beverages'],₹200 FOR TWO,71.0,True,Shop No. 26 BLOCK-A1 bldg Khau gali Niranjan Park Anand Nagar Pune Maharashtra 411051 India,Veg,Low,Restaurant: Healthycious. Area: Sinhgad Road. Cuisine: ['Fast Food' 'Salads' 'Beverages']. Budget: Low. Rating: --. Reviews: Too Few Ratings. Diet: Veg. Delivery: 71.0 mins. Address: Shop No. 26 BLOCK-A1 bldg Khau gali Niranjan Park Anand Nagar Pune Maharashtra 411051 India.
BANJARA,Pune,Aundh,--,Too Few Ratings,['Indian' 'Biryani'],₹400 FOR TWO,72.0,False,PLOT NO-13SR NO.157AUNDHPUNE-411007 Dis trict - Pune PMC STATE - Maharas htra - 411007,Non-Veg,Medium,Restaurant: BANJARA. Area: Aundh. Cuisine: ['Indian' 'Biryani']. Budget: Medium. Rating: --. Reviews: Too Few Ratings. Diet: Non-Veg. Delivery: 72.0 mins. Address: PLOT NO-13SR NO.157AUNDHPUNE-411007 Dis trict - Pune PMC STATE - Maharas htra - 411007.
Largo Pizzeria,Pune,Mohammed Wadi,3.6,50+ ratings,['Pizzas' 'Beverages'],₹600 FOR TWO,72.0,False,Shop A1-A2 Green Acres Society Salunkhe Vihar Road Pune,Non-Veg,High,Restaurant: Largo Pizzeria. Area: Mohammed Wadi. Cuisine: ['Pizzas' 'Beverages']. Budget: High. Rating: 3.6. Reviews: 50+ ratings. Diet: Non-Veg. Delivery: 72.0 mins. Address: Shop A1-A2 Green Acres Society Salunkhe Vihar Road Pune.
YUMMY CHINA,Pune,Aundh,--,Too Few Ratings,['Chinese' 'Indian'],₹300 FOR TWO,69.0,False,PLOT NO 13 SR NO 157 AUNDH PUNE 411007 AUNDH PUNE PMC(MAHARASHTRA) 411007 Maharashtra,Non-Veg,Medium,Restaurant: YUMMY CHINA. Area: Aundh. Cuisine: ['Chinese' 'Indian']. Budget: Medium. Rating: --. Reviews: Too Few Ratings. Diet: Non-Veg. Delivery: 69.0 mins. Address: PLOT NO 13 SR NO 157 AUNDH PUNE 411007 AUNDH PUNE PMC(MAHARASHTRA) 411007 Maharashtra.
SAFFRONI,Pune,Aundh,--,Too Few Ratings,['North Indian'],₹300 FOR TWO,69.0,False,PLOT	NO-13SR	NO.157AUNDHPUNE-411007	Dis	trict	-	Pune	PMC	STATE -	Maharashtra,Non-Veg,Medium,Restaurant: SAFFRONI. Area: Aundh. Cuisine: ['North Indian']. Budget: Medium. Rating: --. Reviews: Too Few Ratings. Diet: Non-Veg. Delivery: 69.0 mins. Address: PLOT	NO-13SR	NO.157AUNDHPUNE-411007	Dis	trict	-	Pune	PMC	STATE -	Maharashtra.
SAGAR  RATAN,Pune,Aundh,--,Too Few Ratings,['Indian'],₹300 FOR TWO,69.0,False,PLOT NO-13SR NO.157AUNDHPUNE-411007 Dis trict - Pune PMC STATE  - Maharashtra,Non-Veg,Medium,Restaurant: SAGAR  RATAN. Area: Aundh. Cuisine: ['Indian']. Budget: Medium. Rating: --. Reviews: Too Few Ratings. Diet: Non-Veg. Delivery: 69.0 mins. Address: PLOT NO-13SR NO.157AUNDHPUNE-411007 Dis trict - Pune PMC STATE  - Maharashtra.
